dc_identifier,dcterms_extent,ldp_contains,fedora_writable,fedora_created,dc_creator,dcterms_spatial,dcterms_medium,tamudigital_local/details,fedora_lastModifiedBy,dc_type,fedora_hasParent,dc_subject,fedora_lastModified,dc_title,dc_rights,dcterms_type,dc_format,fedora_createdBy,files,dc_relation,dcterms_temporal,dcterms_created,dc_contributor
1105|C164T,"1 sheet of red, gray, black and white marbled paper; 20.25 x 25.25 in.",https://api.library.tamu.edu/fcrepo/rest/3b/6f/c3/25/3b6fc325-f6ca-41d8-b91e-8c5db3be8c13/fb/00/6c/bc/fb006cbc-d2e5-4fcb-9321-62b6385720d0/berger_cloonan_batch_7_objects/80/pages|https://api.library.tamu.edu/fcrepo/rest/3b/6f/c3/25/3b6fc325-f6ca-41d8-b91e-8c5db3be8c13/fb/00/6c/bc/fb006cbc-d2e5-4fcb-9321-62b6385720d0/berger_cloonan_batch_7_objects/80/orderProxies,false,2022-06-21T13:53:39.387000+00:00,"Cockerell, Sydney Morris|Cockerell, Douglas",England--Cambridge,Paper,"Surface application; Marbled; M4.D3.F7; Sidney E. Berger and Michele V. Cloonan purchased the sheet from Ian Harkness.; Section(s) from the Decorated and Decorative Paper Terms Thesaurus: VIII.F.1.c; Not signed; Stamped; Not stickered; Not embossed; Douglas Cockerell and Sidney Cockerell, father and son, were both talented English marblers. They marbled beginning in the 1970s.; [stamped in black ink on verso]: [copyright symbol] COCKERELL 1996 BARTON CAMBRIDGE CB3 7AD ENGLAND Tel/Fax 01223 262430 NO UNAUTHORISED REPRODUCTION""; [stamped in black ink on verso]: ""Ian Harkness English Hand Marbled Papers 214-859-9010 To Re-Order Quote Ref C164T""; [stamped in black ink on verso]: ""FINEST ENGLISH HAND MARBLED DESIGN FROM THE COCKERELL STUDIO EST. OVER 80 YRS""; [written in pencil on verso]: ""C164T""",fedoraAdmin,Dutch marbled paper|French snail marbled papers|art reproduction|curl marbled paper,https://api.library.tamu.edu/fcrepo/rest/3b/6f/c3/25/3b6fc325-f6ca-41d8-b91e-8c5db3be8c13/fb/00/6c/bc/fb006cbc-d2e5-4fcb-9321-62b6385720d0/berger_cloonan_batch_7_objects,Marbled papers,2022-06-21T13:53:39.387000+00:00,Berger-Cloonan #1105,In copyright; For more information see: http://rightsstatements.org/vocab/InC/1.0/,StillImage,reformatted digital,fedoraAdmin,https://api.library.tamu.edu/fcrepo/rest/3b/6f/c3/25/3b6fc325-f6ca-41d8-b91e-8c5db3be8c13/fb/00/6c/bc/fb006cbc-d2e5-4fcb-9321-62b6385720d0/berger_cloonan_batch_7_objects/80/pages/page_0/files/01105.jpg,,1990s,1996,Cockerell
4417,"1 sheet of black, gray and white marbled paper; 19.50 x 27.50 in.",https://api.library.tamu.edu/fcrepo/rest/3b/6f/c3/25/3b6fc325-f6ca-41d8-b91e-8c5db3be8c13/fb/00/6c/bc/fb006cbc-d2e5-4fcb-9321-62b6385720d0/berger_cloonan_batch_7_objects/127/pages|https://api.library.tamu.edu/fcrepo/rest/3b/6f/c3/25/3b6fc325-f6ca-41d8-b91e-8c5db3be8c13/fb/00/6c/bc/fb006cbc-d2e5-4fcb-9321-62b6385720d0/berger_cloonan_batch_7_objects/127/orderProxies,false,2022-06-21T13:54:57.484000+00:00,"Frigge, Karli",Netherlands,Paper,"Distribution of fibers; Surface application; Laid; Marbled; M4.D3.F4; Agate marble with dark gray background with ""eyeball""; effect; laid paper; Section(s) from the Decorated and Decorative Paper Terms Thesaurus: II.E; VIII.F.4.f; Not signed; Stamped; Ink and marks on verso;; The Berger/Cloonan paper collection contains a large number of the works of Karli Frigge. Sidney E. Berger wrote Karli Frigge's Life in Marbling (Newtown, PA: Bird & Bull Press, 2004), in which he claims that Karli Frigge is perhaps the greatest marbler in history.; [stamped in black ink on verso]: ""KARLI FRIGGE LOCHEMSEWEG 75 7215 RA JOPPE NEDERLAND [printed in an open square]""",fedoraAdmin,art reproduction|Stone marbled papers,https://api.library.tamu.edu/fcrepo/rest/3b/6f/c3/25/3b6fc325-f6ca-41d8-b91e-8c5db3be8c13/fb/00/6c/bc/fb006cbc-d2e5-4fcb-9321-62b6385720d0/berger_cloonan_batch_7_objects,Marbled papers,2022-06-21T13:54:57.484000+00:00,Berger-Cloonan #4417,In copyright; For more information see: http://rightsstatements.org/vocab/InC/1.0/,StillImage,reformatted digital,fedoraAdmin,https://api.library.tamu.edu/fcrepo/rest/3b/6f/c3/25/3b6fc325-f6ca-41d8-b91e-8c5db3be8c13/fb/00/6c/bc/fb006cbc-d2e5-4fcb-9321-62b6385720d0/berger_cloonan_batch_7_objects/127/pages/page_0/files/04417.jpg,,,,
1089,"1 sheet of brown, gray, black and white marbled paper; 3.00 x 17.25 in.",https://api.library.tamu.edu/fcrepo/rest/3b/6f/c3/25/3b6fc325-f6ca-41d8-b91e-8c5db3be8c13/fb/00/6c/bc/fb006cbc-d2e5-4fcb-9321-62b6385720d0/berger_cloonan_batch_7_objects/64/pages|https://api.library.tamu.edu/fcrepo/rest/3b/6f/c3/25/3b6fc325-f6ca-41d8-b91e-8c5db3be8c13/fb/00/6c/bc/fb006cbc-d2e5-4fcb-9321-62b6385720d0/berger_cloonan_batch_7_objects/64/orderProxies,false,2022-06-21T13:53:09.885000+00:00,"Cockerell, Douglas|Cockerell, Sydney Morris",England,Paper,"Surface application; Marbled; M4.D5.F5; Sidney E. Berger and Michele V. Cloonan purchased the sheet from the Paper Source in Los Angeles, California circa 1988.; Section(s) from the Decorated and Decorative Paper Terms Thesaurus: VIII.F.1; Not signed; Not stamped; Not stickered; Not embossed; Douglas Cockerell and Sidney Cockerell, father and son, were both talented English marblers. They marbled beginning in the 1970s.",fedoraAdmin,Combed marbled papers|art reproduction|curl marbled paper,https://api.library.tamu.edu/fcrepo/rest/3b/6f/c3/25/3b6fc325-f6ca-41d8-b91e-8c5db3be8c13/fb/00/6c/bc/fb006cbc-d2e5-4fcb-9321-62b6385720d0/berger_cloonan_batch_7_objects,Marbled papers,2022-06-21T13:53:09.885000+00:00,Berger-Cloonan #1089,In copyright; For more information see: http://rightsstatements.org/vocab/InC/1.0/,StillImage,reformatted digital,fedoraAdmin,https://api.library.tamu.edu/fcrepo/rest/3b/6f/c3/25/3b6fc325-f6ca-41d8-b91e-8c5db3be8c13/fb/00/6c/bc/fb006cbc-d2e5-4fcb-9321-62b6385720d0/berger_cloonan_batch_7_objects/64/pages/page_0/files/01089.jpg,,,,Cockerell
1124,"1 sheet of blue, red and white marbled paper; 20.25 x 25.25 in.",https://api.library.tamu.edu/fcrepo/rest/3b/6f/c3/25/3b6fc325-f6ca-41d8-b91e-8c5db3be8c13/fb/00/6c/bc/fb006cbc-d2e5-4fcb-9321-62b6385720d0/berger_cloonan_batch_7_objects/99/orderProxies|https://api.library.tamu.edu/fcrepo/rest/3b/6f/c3/25/3b6fc325-f6ca-41d8-b91e-8c5db3be8c13/fb/00/6c/bc/fb006cbc-d2e5-4fcb-9321-62b6385720d0/berger_cloonan_batch_7_objects/99/pages,false,2022-06-21T13:54:12.609000+00:00,"Cockerell, Sydney Morris|Cockerell, Douglas",England--Cambridge,Paper,"Surface application; Marbled; M4.D3.F7; Section(s) from the Decorated and Decorative Paper Terms Thesaurus: VIII.F.1; Not signed; Stamped; Not stickered; Not embossed; Douglas Cockerell and Sidney Cockerell, father and son, were both talented English marblers. They marbled beginning in the 1970s.; [stamped in black ink on verso]: [copyright symbol] COCKERELL 1991 BARTON CAMBRIDGE CB3 7AD ENGLAND Tel/Fax 01223 262430 NO UNAUTHORISED REPRODUCTION""; [stamped in black ink on verso]: [copyright symbol] COCKERELL 1996 BARTON CAMBRIDGE CB3 7AD ENGLAND Tel/Fax 01223 262430 NO UNAUTHORISED REPRODUCTION""; [written in black ink on verso]: ""2nd""",fedoraAdmin,Combed marbled papers|art reproduction|curl marbled paper,https://api.library.tamu.edu/fcrepo/rest/3b/6f/c3/25/3b6fc325-f6ca-41d8-b91e-8c5db3be8c13/fb/00/6c/bc/fb006cbc-d2e5-4fcb-9321-62b6385720d0/berger_cloonan_batch_7_objects,Marbled papers,2022-06-21T13:54:12.609000+00:00,Berger-Cloonan #1124,In copyright; For more information see: http://rightsstatements.org/vocab/InC/1.0/,StillImage,reformatted digital,fedoraAdmin,https://api.library.tamu.edu/fcrepo/rest/3b/6f/c3/25/3b6fc325-f6ca-41d8-b91e-8c5db3be8c13/fb/00/6c/bc/fb006cbc-d2e5-4fcb-9321-62b6385720d0/berger_cloonan_batch_7_objects/99/pages/page_0/files/01124.jpg,,1990s,1990s,Cockerell
996,"1 sheet of blue, red, green, yellow and light brown marbled paper; 15.50 x 17.00 (uneven edges) in.",https://api.library.tamu.edu/fcrepo/rest/3b/6f/c3/25/3b6fc325-f6ca-41d8-b91e-8c5db3be8c13/fb/00/6c/bc/fb006cbc-d2e5-4fcb-9321-62b6385720d0/berger_cloonan_batch_7_objects/38/pages|https://api.library.tamu.edu/fcrepo/rest/3b/6f/c3/25/3b6fc325-f6ca-41d8-b91e-8c5db3be8c13/fb/00/6c/bc/fb006cbc-d2e5-4fcb-9321-62b6385720d0/berger_cloonan_batch_7_objects/38/orderProxies,false,2022-06-21T13:52:27.840000+00:00,"Ozeum, Mr.",China--Xinjiang Uygur Zizhiqu,Paper,"Surface application; Marbled; M4.D5.F1; Mr. Ozeum donated the sheet to Sidney E. Berger and Michele V. Cloonan.; Section(s) from the Decorated and Decorative Paper Terms Thesaurus: VIII.F.4.g; Not signed; Stamped; Not stickered; Not embossed; #00996 and #00997 stored together in onion paper folder; sheet stapled to onion paper folder; [stamped in purple ink on paper folder] ""KHOTAN PAPER, Handmade and marbled, Xinjiang Uygur Autonomous Region PRC, CACAS, Central Asian Culture Art Society""; [stamped in purple ink on paper folder]: ""Limited Edition #all rights by OZEUM <uygur13@tnn.net>""",fedoraAdmin,art reproduction|Stormont marbled paper,https://api.library.tamu.edu/fcrepo/rest/3b/6f/c3/25/3b6fc325-f6ca-41d8-b91e-8c5db3be8c13/fb/00/6c/bc/fb006cbc-d2e5-4fcb-9321-62b6385720d0/berger_cloonan_batch_7_objects,Marbled papers,2022-06-21T13:52:27.840000+00:00,Berger-Cloonan #996,In copyright; For more information see: http://rightsstatements.org/vocab/InC/1.0/,StillImage,reformatted digital,fedoraAdmin,https://api.library.tamu.edu/fcrepo/rest/3b/6f/c3/25/3b6fc325-f6ca-41d8-b91e-8c5db3be8c13/fb/00/6c/bc/fb006cbc-d2e5-4fcb-9321-62b6385720d0/berger_cloonan_batch_7_objects/38/pages/page_0/files/00996.jpg,M4.D5.F1.A,,,Central Asian Culture Art Society
4432,"1 sheet of gray, red, pink, black, white and cream marbled paper; 19.50 x 27.50 in.",https://api.library.tamu.edu/fcrepo/rest/3b/6f/c3/25/3b6fc325-f6ca-41d8-b91e-8c5db3be8c13/fb/00/6c/bc/fb006cbc-d2e5-4fcb-9321-62b6385720d0/berger_cloonan_batch_7_objects/132/orderProxies|https://api.library.tamu.edu/fcrepo/rest/3b/6f/c3/25/3b6fc325-f6ca-41d8-b91e-8c5db3be8c13/fb/00/6c/bc/fb006cbc-d2e5-4fcb-9321-62b6385720d0/berger_cloonan_batch_7_objects/132/pages,false,2022-06-21T13:55:09.112000+00:00,"Frigge, Karli",Netherlands,Paper,"Distribution of fibers; Surface application; Laid; Marbled; M4.D3.F4; Agate marble with 8 nuclei or (5 medium, 3 small) spheres containing a range of abstract images (""eye""; and cellular); laid paper; Section(s) from the Decorated and Decorative Paper Terms Thesaurus: II.E; VIII.F.4.f; Not signed; Stamped; Ink spots on recto; slightly curled with slightly creased edges; The Berger/Cloonan paper collection contains a large number of the works of Karli Frigge. Sidney E. Berger wrote Karli Frigge's Life in Marbling (Newtown, PA: Bird & Bull Press, 2004), in which he claims that Karli Frigge is perhaps the greatest marbler in history.; [stamped in black ink on verso]: ""KARLI FRIGGE LOCHEMSEWEG 75 7215 RA JOPPE NEDERLAND [printed in an open square]""",fedoraAdmin,art reproduction|Stone marbled papers,https://api.library.tamu.edu/fcrepo/rest/3b/6f/c3/25/3b6fc325-f6ca-41d8-b91e-8c5db3be8c13/fb/00/6c/bc/fb006cbc-d2e5-4fcb-9321-62b6385720d0/berger_cloonan_batch_7_objects,Marbled papers,2022-06-21T13:55:09.112000+00:00,Berger-Cloonan #4432,In copyright; For more information see: http://rightsstatements.org/vocab/InC/1.0/,StillImage,reformatted digital,fedoraAdmin,https://api.library.tamu.edu/fcrepo/rest/3b/6f/c3/25/3b6fc325-f6ca-41d8-b91e-8c5db3be8c13/fb/00/6c/bc/fb006cbc-d2e5-4fcb-9321-62b6385720d0/berger_cloonan_batch_7_objects/132/pages/page_0/files/04432.jpg,,,,
6279,"1 sheet of green, light purple, black and blue marbled paper; 31.00 x 43.00 in.",https://api.library.tamu.edu/fcrepo/rest/3b/6f/c3/25/3b6fc325-f6ca-41d8-b91e-8c5db3be8c13/fb/00/6c/bc/fb006cbc-d2e5-4fcb-9321-62b6385720d0/berger_cloonan_batch_7_objects/150/orderProxies|https://api.library.tamu.edu/fcrepo/rest/3b/6f/c3/25/3b6fc325-f6ca-41d8-b91e-8c5db3be8c13/fb/00/6c/bc/fb006cbc-d2e5-4fcb-9321-62b6385720d0/berger_cloonan_batch_7_objects/150/pages,false,2022-06-21T13:55:36.135000+00:00,"Miura, Einen",,Paper,"Surface application; Marbled; M5.D4.F14; Section(s) from the Decorated and Decorative Paper Terms Thesaurus: VIII.F.1; Signed; Not stamped; Not stickered; Not embossed; Corner and edge creased; [written in silver ink on recto]: ""EINEN""",fedoraAdmin,Combed marbled papers|art reproduction,https://api.library.tamu.edu/fcrepo/rest/3b/6f/c3/25/3b6fc325-f6ca-41d8-b91e-8c5db3be8c13/fb/00/6c/bc/fb006cbc-d2e5-4fcb-9321-62b6385720d0/berger_cloonan_batch_7_objects,Marbled papers,2022-06-21T13:55:36.135000+00:00,Berger-Cloonan #6279,In copyright; For more information see: http://rightsstatements.org/vocab/InC/1.0/,StillImage,reformatted digital,fedoraAdmin,https://api.library.tamu.edu/fcrepo/rest/3b/6f/c3/25/3b6fc325-f6ca-41d8-b91e-8c5db3be8c13/fb/00/6c/bc/fb006cbc-d2e5-4fcb-9321-62b6385720d0/berger_cloonan_batch_7_objects/150/pages/page_0/files/06279.jpg,M5.D4.F14.A,,,
3H32|1078,1 sheet of brown and white paste paper; 17.50 x 25.00 in.,https://api.library.tamu.edu/fcrepo/rest/3b/6f/c3/25/3b6fc325-f6ca-41d8-b91e-8c5db3be8c13/fb/00/6c/bc/fb006cbc-d2e5-4fcb-9321-62b6385720d0/berger_cloonan_batch_7_objects/53/orderProxies|https://api.library.tamu.edu/fcrepo/rest/3b/6f/c3/25/3b6fc325-f6ca-41d8-b91e-8c5db3be8c13/fb/00/6c/bc/fb006cbc-d2e5-4fcb-9321-62b6385720d0/berger_cloonan_batch_7_objects/53/pages,false,2022-06-21T13:52:47.822000+00:00,"Hall, Victoria",England--Norwich,Paper,"Surface application; Paste; M4.D5.F3; Sidney E. Berger and Michele V. Cloonan purchased the sheet from Ian Harkness.; Section(s) from the Decorated and Decorative Paper Terms Thesaurus: VIII.G.2; Not signed; Stamped; Not stickered; Not embossed; [stamped in black ink on verso]: ""Victoria Marbling  HAND DECORATED PAPERS BY VICTORIA HALL, St. Mary's Works, Duke Street, Norwich, NR3 1QA ENGLAND Tel: 01603 76441""; [stamped in red ink on verso]: ""Copyright [copyright symbol] 1994, No unauthorized reproduction""; [stamped in black ink on verso]: ""Ian Harkness English Hand Marbled Papers, 214-869-9010, To Re-Order Quote Ref 3H32""",fedoraAdmin,paste paper|Non-patterned paste papers|art reproduction,https://api.library.tamu.edu/fcrepo/rest/3b/6f/c3/25/3b6fc325-f6ca-41d8-b91e-8c5db3be8c13/fb/00/6c/bc/fb006cbc-d2e5-4fcb-9321-62b6385720d0/berger_cloonan_batch_7_objects,Paste papers,2022-06-21T13:52:47.822000+00:00,Berger-Cloonan #1078,In copyright; For more information see: http://rightsstatements.org/vocab/InC/1.0/,StillImage,reformatted digital,fedoraAdmin,https://api.library.tamu.edu/fcrepo/rest/3b/6f/c3/25/3b6fc325-f6ca-41d8-b91e-8c5db3be8c13/fb/00/6c/bc/fb006cbc-d2e5-4fcb-9321-62b6385720d0/berger_cloonan_batch_7_objects/53/pages/page_0/files/01078.jpg,,1990s,1994,Victoria Marbling
985,"1 sheet of red, green, black and white marbled paper; 9.00 x 13.50 in.",https://api.library.tamu.edu/fcrepo/rest/3b/6f/c3/25/3b6fc325-f6ca-41d8-b91e-8c5db3be8c13/fb/00/6c/bc/fb006cbc-d2e5-4fcb-9321-62b6385720d0/berger_cloonan_batch_7_objects/27/pages|https://api.library.tamu.edu/fcrepo/rest/3b/6f/c3/25/3b6fc325-f6ca-41d8-b91e-8c5db3be8c13/fb/00/6c/bc/fb006cbc-d2e5-4fcb-9321-62b6385720d0/berger_cloonan_batch_7_objects/27/orderProxies,false,2022-06-21T13:52:10.477000+00:00,"Yildirim, Nuri Prnar",,Paper,"Surface application; Marbled; M4.D5.F1; Central floral and leaf motif; background is stone marbling; Section(s) from the Decorated and Decorative Paper Terms Thesaurus: VIII.F.2; VIII.F.4.f; Signed; Not stamped; Not stickered; Not embossed; [written in brown ink on verso]: ""2002 - U.S.A. Nuri Prnar YILDIRIM""",fedoraAdmin,agate marbled paper|art reproduction|Figured marbled papers|Stone marbled papers,https://api.library.tamu.edu/fcrepo/rest/3b/6f/c3/25/3b6fc325-f6ca-41d8-b91e-8c5db3be8c13/fb/00/6c/bc/fb006cbc-d2e5-4fcb-9321-62b6385720d0/berger_cloonan_batch_7_objects,Marbled papers,2022-06-21T13:52:10.477000+00:00,Berger-Cloonan #985,In copyright; For more information see: http://rightsstatements.org/vocab/InC/1.0/,StillImage,reformatted digital,fedoraAdmin,https://api.library.tamu.edu/fcrepo/rest/3b/6f/c3/25/3b6fc325-f6ca-41d8-b91e-8c5db3be8c13/fb/00/6c/bc/fb006cbc-d2e5-4fcb-9321-62b6385720d0/berger_cloonan_batch_7_objects/27/pages/page_0/files/00985.jpg,M4.D5.F1.A,2000s,2002,
1119|C93EV,"1 sheet of blue, pink, brown and white marbled paper; 20.25 x 25.25 in.",https://api.library.tamu.edu/fcrepo/rest/3b/6f/c3/25/3b6fc325-f6ca-41d8-b91e-8c5db3be8c13/fb/00/6c/bc/fb006cbc-d2e5-4fcb-9321-62b6385720d0/berger_cloonan_batch_7_objects/94/pages|https://api.library.tamu.edu/fcrepo/rest/3b/6f/c3/25/3b6fc325-f6ca-41d8-b91e-8c5db3be8c13/fb/00/6c/bc/fb006cbc-d2e5-4fcb-9321-62b6385720d0/berger_cloonan_batch_7_objects/94/orderProxies,false,2022-06-21T13:53:59.774000+00:00,"Cockerell, Douglas|Cockerell, Sydney Morris",England--Cambridge,Paper,"Surface application; Marbled; M4.D3.F7; Sidney E. Berger and Michele V. Cloonan purchased the sheet from Ian Harkness.; Section(s) from the Decorated and Decorative Paper Terms Thesaurus: VIII.F.1; Not signed; Stamped; Not stickered; Not embossed; Douglas Cockerell and Sidney Cockerell, father and son, were both talented English marblers. They marbled beginning in the 1970s.; [stamped in black ink on verso]: [copyright symbol] COCKERELL 1996 BARTON CAMBRIDGE CB3 7AD ENGLAND Tel/Fax 01223 262430 NO UNAUTHORISED REPRODUCTION""; [stamped in black ink on verso]: ""Ian Harkness English Hand Marbled Papers 214-859-9010 To Re-Order Quote Ref C93EV""; [stamped in black ink on verso]: ""FINEST ENGLISH HAND MARBLED DESIGN FROM THE COCKERELL STUDIO EST. OVER 80 YRS""",fedoraAdmin,Combed marbled papers|art reproduction|curl marbled paper,https://api.library.tamu.edu/fcrepo/rest/3b/6f/c3/25/3b6fc325-f6ca-41d8-b91e-8c5db3be8c13/fb/00/6c/bc/fb006cbc-d2e5-4fcb-9321-62b6385720d0/berger_cloonan_batch_7_objects,Marbled papers,2022-06-21T13:53:59.774000+00:00,Berger-Cloonan #1119,In copyright; For more information see: http://rightsstatements.org/vocab/InC/1.0/,StillImage,reformatted digital,fedoraAdmin,https://api.library.tamu.edu/fcrepo/rest/3b/6f/c3/25/3b6fc325-f6ca-41d8-b91e-8c5db3be8c13/fb/00/6c/bc/fb006cbc-d2e5-4fcb-9321-62b6385720d0/berger_cloonan_batch_7_objects/94/pages/page_0/files/01119.jpg,,1990s,1996,Cockerell
CO6FX|1103,"1 sheet of blue, black and white marbled paper; 20.25 x 25.25 in.",https://api.library.tamu.edu/fcrepo/rest/3b/6f/c3/25/3b6fc325-f6ca-41d8-b91e-8c5db3be8c13/fb/00/6c/bc/fb006cbc-d2e5-4fcb-9321-62b6385720d0/berger_cloonan_batch_7_objects/78/pages|https://api.library.tamu.edu/fcrepo/rest/3b/6f/c3/25/3b6fc325-f6ca-41d8-b91e-8c5db3be8c13/fb/00/6c/bc/fb006cbc-d2e5-4fcb-9321-62b6385720d0/berger_cloonan_batch_7_objects/78/orderProxies,false,2022-06-21T13:53:37.796000+00:00,"Cockerell, Douglas|Cockerell, Sydney Morris",England--Cambridge,Paper,"Surface application; Marbled; M4.D3.F7; Sidney E. Berger and Michele V. Cloonan purchased the sheet from Ian Harkness.; Section(s) from the Decorated and Decorative Paper Terms Thesaurus: VIII.F.1; Not signed; Stamped; Not stickered; Not embossed; Douglas Cockerell and Sidney Cockerell, father and son, were both talented English marblers. They marbled beginning in the 1970s.; [stamped in black ink on verso]: [copyright symbol] COCKERELL 1996 BARTON CAMBRIDGE CB3 7AD ENGLAND Tel/Fax 01223 262430 NO UNAUTHORISED REPRODUCTION"" ""FINEST ENGLISH HAND MARBLED DESIGN FROM THE COCKERELL STUDIO EST. OVER 80 YRS""; [stamped in black ink on verso]: ""Ian Harkness English Hand Marbled Papers 214-859-9010 To Re-Order Quote Ref C06RK""; [written in pencil on verso]: ""CO6FX""",fedoraAdmin,art reproduction|Combed marbled papers|curl marbled paper,https://api.library.tamu.edu/fcrepo/rest/3b/6f/c3/25/3b6fc325-f6ca-41d8-b91e-8c5db3be8c13/fb/00/6c/bc/fb006cbc-d2e5-4fcb-9321-62b6385720d0/berger_cloonan_batch_7_objects,Marbled papers,2022-06-21T13:53:37.796000+00:00,Berger-Cloonan #1103,In copyright; For more information see: http://rightsstatements.org/vocab/InC/1.0/,StillImage,reformatted digital,fedoraAdmin,https://api.library.tamu.edu/fcrepo/rest/3b/6f/c3/25/3b6fc325-f6ca-41d8-b91e-8c5db3be8c13/fb/00/6c/bc/fb006cbc-d2e5-4fcb-9321-62b6385720d0/berger_cloonan_batch_7_objects/78/pages/page_0/files/01103.jpg,,1990s,1996,Cockerell
1136,"1 sheet of blue, pink, green and white marbled paper; 20.25 x 25.25 in.",https://api.library.tamu.edu/fcrepo/rest/3b/6f/c3/25/3b6fc325-f6ca-41d8-b91e-8c5db3be8c13/fb/00/6c/bc/fb006cbc-d2e5-4fcb-9321-62b6385720d0/berger_cloonan_batch_7_objects/111/pages|https://api.library.tamu.edu/fcrepo/rest/3b/6f/c3/25/3b6fc325-f6ca-41d8-b91e-8c5db3be8c13/fb/00/6c/bc/fb006cbc-d2e5-4fcb-9321-62b6385720d0/berger_cloonan_batch_7_objects/111/orderProxies,false,2022-06-21T13:54:33.228000+00:00,"Cockerell, Sydney Morris|Cockerell, Douglas",England,Paper,"Surface application; Marbled; M4.D3.F7; Section(s) from the Decorated and Decorative Paper Terms Thesaurus: VIII.F.1.c; Not signed; Stamped; Not stickered; Not embossed; Douglas Cockerell and Sidney Cockerell, father and son, were both talented English marblers. They marbled beginning in the 1970s.; [stamped in black ink on verso]: [copyright symbol] COCKERELL 1996 BARTON CAMBRIDGE CB3 7AD ENGLAND Tel/Fax 01223 262430 NO UNAUTHORISED REPRODUCTION""; [written in blue ink on verso]: ""2nd""",fedoraAdmin,curl marbled paper|Combed marbled papers|art reproduction,https://api.library.tamu.edu/fcrepo/rest/3b/6f/c3/25/3b6fc325-f6ca-41d8-b91e-8c5db3be8c13/fb/00/6c/bc/fb006cbc-d2e5-4fcb-9321-62b6385720d0/berger_cloonan_batch_7_objects,Marbled papers,2022-06-21T13:54:33.228000+00:00,Berger-Cloonan #1136,In copyright; For more information see: http://rightsstatements.org/vocab/InC/1.0/,StillImage,reformatted digital,fedoraAdmin,https://api.library.tamu.edu/fcrepo/rest/3b/6f/c3/25/3b6fc325-f6ca-41d8-b91e-8c5db3be8c13/fb/00/6c/bc/fb006cbc-d2e5-4fcb-9321-62b6385720d0/berger_cloonan_batch_7_objects/111/pages/page_0/files/01136.jpg,,1990s,1996,Cockerell
6275,"1 sheet of light blue, dark blue, white and cream marbled paper; 19.50 x 25.50 in.",https://api.library.tamu.edu/fcrepo/rest/3b/6f/c3/25/3b6fc325-f6ca-41d8-b91e-8c5db3be8c13/fb/00/6c/bc/fb006cbc-d2e5-4fcb-9321-62b6385720d0/berger_cloonan_batch_7_objects/146/pages|https://api.library.tamu.edu/fcrepo/rest/3b/6f/c3/25/3b6fc325-f6ca-41d8-b91e-8c5db3be8c13/fb/00/6c/bc/fb006cbc-d2e5-4fcb-9321-62b6385720d0/berger_cloonan_batch_7_objects/146/orderProxies,false,2022-06-21T13:55:32.617000+00:00,"Miura, Einen",,Paper,"Surface application; Marbled; M5.D4.F14; Unique crystal design; Section(s) from the Decorated and Decorative Paper Terms Thesaurus: VIII.F.4; Signed; Not stamped; Stickered; Not embossed; 4 pieces of yellow tape along edge on verso; stained on verso; [written in pencil on verso]: ""EINEN 1982""; [written in blue ink on yellow post-it note on recto]: ""This is our last sheet of Einen's 'CRYSTAL' paper.""",fedoraAdmin,marbled paper|art reproduction|Random marbled papers,https://api.library.tamu.edu/fcrepo/rest/3b/6f/c3/25/3b6fc325-f6ca-41d8-b91e-8c5db3be8c13/fb/00/6c/bc/fb006cbc-d2e5-4fcb-9321-62b6385720d0/berger_cloonan_batch_7_objects,Marbled papers,2022-06-21T13:55:32.617000+00:00,Berger-Cloonan #6275: Crystal,In copyright; For more information see: http://rightsstatements.org/vocab/InC/1.0/,StillImage,reformatted digital,fedoraAdmin,https://api.library.tamu.edu/fcrepo/rest/3b/6f/c3/25/3b6fc325-f6ca-41d8-b91e-8c5db3be8c13/fb/00/6c/bc/fb006cbc-d2e5-4fcb-9321-62b6385720d0/berger_cloonan_batch_7_objects/146/pages/page_0/files/06275.jpg,M5.D4.F14.A,1980s,1982,
1108,"1 sheet of blue, brown, black and white marbled paper; 20.25 x 25.25 in.",https://api.library.tamu.edu/fcrepo/rest/3b/6f/c3/25/3b6fc325-f6ca-41d8-b91e-8c5db3be8c13/fb/00/6c/bc/fb006cbc-d2e5-4fcb-9321-62b6385720d0/berger_cloonan_batch_7_objects/83/pages|https://api.library.tamu.edu/fcrepo/rest/3b/6f/c3/25/3b6fc325-f6ca-41d8-b91e-8c5db3be8c13/fb/00/6c/bc/fb006cbc-d2e5-4fcb-9321-62b6385720d0/berger_cloonan_batch_7_objects/83/orderProxies,false,2022-06-21T13:53:40.444000+00:00,"Cockerell, Douglas|Cockerell, Sydney Morris",England--Cambridge,Paper,"Surface application; Marbled; M4.D3.F7; Section(s) from the Decorated and Decorative Paper Terms Thesaurus: VIII.F.1.a; Not signed; Stamped; Not stickered; Not embossed; Douglas Cockerell and Sidney Cockerell, father and son, were both talented English marblers. They marbled beginning in the 1970s.; [stamped in black ink on verso]: [copyright symbol] COCKERELL 1996 BARTON CAMBRIDGE CB3 7AD ENGLAND Tel/Fax 01223 262430 NO UNAUTHORISED REPRODUCTION""; [written in blue ink on verso]: ""2nd""",fedoraAdmin,art reproduction|curl marbled paper|Bouquet marbled papers,https://api.library.tamu.edu/fcrepo/rest/3b/6f/c3/25/3b6fc325-f6ca-41d8-b91e-8c5db3be8c13/fb/00/6c/bc/fb006cbc-d2e5-4fcb-9321-62b6385720d0/berger_cloonan_batch_7_objects,Marbled papers,2022-06-21T13:53:40.444000+00:00,Berger-Cloonan #1108,In copyright; For more information see: http://rightsstatements.org/vocab/InC/1.0/,StillImage,reformatted digital,fedoraAdmin,https://api.library.tamu.edu/fcrepo/rest/3b/6f/c3/25/3b6fc325-f6ca-41d8-b91e-8c5db3be8c13/fb/00/6c/bc/fb006cbc-d2e5-4fcb-9321-62b6385720d0/berger_cloonan_batch_7_objects/83/pages/page_0/files/01108.jpg,,1990s,1996,Cockerell
