dc_identifier,dcterms_extent,ldp_contains,fedora_writable,fedora_created,dc_creator,dcterms_spatial,dcterms_medium,tamudigital_local/details,fedora_lastModifiedBy,dc_type,fedora_hasParent,dc_subject,fedora_lastModified,dc_title,dc_rights,dcterms_type,dc_format,fedora_createdBy,files,dc_relation,dcterms_temporal,dcterms_created,dc_contributor
1126,"1 sheet of light red, blue, yellow and brown marbled paper; 20.25 x 25.25 in.",https://api.library.tamu.edu/fcrepo/rest/3b/6f/c3/25/3b6fc325-f6ca-41d8-b91e-8c5db3be8c13/fb/00/6c/bc/fb006cbc-d2e5-4fcb-9321-62b6385720d0/berger_cloonan_batch_7_objects/101/orderProxies|https://api.library.tamu.edu/fcrepo/rest/3b/6f/c3/25/3b6fc325-f6ca-41d8-b91e-8c5db3be8c13/fb/00/6c/bc/fb006cbc-d2e5-4fcb-9321-62b6385720d0/berger_cloonan_batch_7_objects/101/pages,false,2022-06-21T13:54:15.812000+00:00,"Cockerell, Douglas|Cockerell, Sydney Morris",England--Cambridge,Paper,"Surface application; Marbled; M4.D3.F7; Sidney E. Berger and Michele V. Cloonan purchased the sheet from Ian Harkness.; Section(s) from the Decorated and Decorative Paper Terms Thesaurus: VIII.F.1; Not signed; Stamped; Not stickered; Not embossed; Douglas Cockerell and Sidney Cockerell, father and son, were both talented English marblers. They marbled beginning in the 1970s.; [stamped in black ink on verso]: [copyright symbol] COCKERELL 1995 BARTON CAMBRIDGE CB3 7AD ENGLAND Tel/Fax 01223 262430 NO UNAUTHORISED REPRODUCTION""; [stamped in black ink on verso]: ""Ian Harkness English Hand Marbled Papers 214-859-9010 To Re-Order Quote Ref ___""",fedoraAdmin,art reproduction|Combed marbled papers|curl marbled paper,https://api.library.tamu.edu/fcrepo/rest/3b/6f/c3/25/3b6fc325-f6ca-41d8-b91e-8c5db3be8c13/fb/00/6c/bc/fb006cbc-d2e5-4fcb-9321-62b6385720d0/berger_cloonan_batch_7_objects,Marbled papers,2022-06-21T13:54:15.812000+00:00,Berger-Cloonan #1126,In copyright; For more information see: http://rightsstatements.org/vocab/InC/1.0/,StillImage,reformatted digital,fedoraAdmin,https://api.library.tamu.edu/fcrepo/rest/3b/6f/c3/25/3b6fc325-f6ca-41d8-b91e-8c5db3be8c13/fb/00/6c/bc/fb006cbc-d2e5-4fcb-9321-62b6385720d0/berger_cloonan_batch_7_objects/101/pages/page_0/files/01126.jpg,,1990s,1995,Cockerell
4440,"1 sheet of green, black, white and cream marbled paper; 19.50 x 27.50 in.",https://api.library.tamu.edu/fcrepo/rest/3b/6f/c3/25/3b6fc325-f6ca-41d8-b91e-8c5db3be8c13/fb/00/6c/bc/fb006cbc-d2e5-4fcb-9321-62b6385720d0/berger_cloonan_batch_7_objects/136/orderProxies|https://api.library.tamu.edu/fcrepo/rest/3b/6f/c3/25/3b6fc325-f6ca-41d8-b91e-8c5db3be8c13/fb/00/6c/bc/fb006cbc-d2e5-4fcb-9321-62b6385720d0/berger_cloonan_batch_7_objects/136/pages,false,2022-06-21T13:55:14.901000+00:00,"Frigge, Karli",Netherlands,Paper,"Distribution of fibers; Surface application; Laid; Marbled; M4.D3.F4; Agate marble with densely cellular aspect; laid paper; Section(s) from the Decorated and Decorative Paper Terms Thesaurus: II.E; VIII.F.4.f; Not signed; Stamped; Ink on verso; creased; The Berger/Cloonan paper collection contains a large number of the works of Karli Frigge. Sidney E. Berger wrote Karli Frigge's Life in Marbling (Newtown, PA: Bird & Bull Press, 2004), in which he claims that Karli Frigge is perhaps the greatest marbler in history.; [stamped in black ink on verso]: ""NUMMER KARLI FRIGGE MARMER PAPIER NEDERLAND [printed in 4 scrolls""; [written in pencil on verso]: ""vernis""",fedoraAdmin,Stone marbled papers|art reproduction|agate marbled paper,https://api.library.tamu.edu/fcrepo/rest/3b/6f/c3/25/3b6fc325-f6ca-41d8-b91e-8c5db3be8c13/fb/00/6c/bc/fb006cbc-d2e5-4fcb-9321-62b6385720d0/berger_cloonan_batch_7_objects,Marbled papers,2022-06-21T13:55:14.901000+00:00,Berger-Cloonan #4440,In copyright; For more information see: http://rightsstatements.org/vocab/InC/1.0/,StillImage,reformatted digital,fedoraAdmin,https://api.library.tamu.edu/fcrepo/rest/3b/6f/c3/25/3b6fc325-f6ca-41d8-b91e-8c5db3be8c13/fb/00/6c/bc/fb006cbc-d2e5-4fcb-9321-62b6385720d0/berger_cloonan_batch_7_objects/136/pages/page_0/files/04440.jpg,,,,
1098,"1 sheet of light brown, gray, black and white marbled paper; 9.75 x 25.25 in.",https://api.library.tamu.edu/fcrepo/rest/3b/6f/c3/25/3b6fc325-f6ca-41d8-b91e-8c5db3be8c13/fb/00/6c/bc/fb006cbc-d2e5-4fcb-9321-62b6385720d0/berger_cloonan_batch_7_objects/73/orderProxies|https://api.library.tamu.edu/fcrepo/rest/3b/6f/c3/25/3b6fc325-f6ca-41d8-b91e-8c5db3be8c13/fb/00/6c/bc/fb006cbc-d2e5-4fcb-9321-62b6385720d0/berger_cloonan_batch_7_objects/73/pages,false,2022-06-21T13:53:21.021000+00:00,"Cockerell, Douglas|Cockerell, Sydney Morris",England,Paper,"Surface application; Marbled; M4.D5.F4; Sidney E. Berger and Michele V. Cloonan purchased the sheet from the Paper Source in Los Angeles, California circa 1988.; Section(s) from the Decorated and Decorative Paper Terms Thesaurus: VIII.F.1; Not signed; Not stamped; Not stickered; Not embossed; Douglas Cockerell and Sidney Cockerell, father and son, were both talented English marblers. They marbled beginning in the 1970s.",fedoraAdmin,Combed marbled papers|art reproduction|curl marbled paper,https://api.library.tamu.edu/fcrepo/rest/3b/6f/c3/25/3b6fc325-f6ca-41d8-b91e-8c5db3be8c13/fb/00/6c/bc/fb006cbc-d2e5-4fcb-9321-62b6385720d0/berger_cloonan_batch_7_objects,Marbled papers,2022-06-21T13:53:21.021000+00:00,Berger-Cloonan #1098,In copyright; For more information see: http://rightsstatements.org/vocab/InC/1.0/,StillImage,reformatted digital,fedoraAdmin,https://api.library.tamu.edu/fcrepo/rest/3b/6f/c3/25/3b6fc325-f6ca-41d8-b91e-8c5db3be8c13/fb/00/6c/bc/fb006cbc-d2e5-4fcb-9321-62b6385720d0/berger_cloonan_batch_7_objects/73/pages/page_0/files/01098.jpg,,,,Cockerell
1082|3H34,1 sheet of red and white paste paper; 17.50 x 25.00 in.,https://api.library.tamu.edu/fcrepo/rest/3b/6f/c3/25/3b6fc325-f6ca-41d8-b91e-8c5db3be8c13/fb/00/6c/bc/fb006cbc-d2e5-4fcb-9321-62b6385720d0/berger_cloonan_batch_7_objects/57/orderProxies|https://api.library.tamu.edu/fcrepo/rest/3b/6f/c3/25/3b6fc325-f6ca-41d8-b91e-8c5db3be8c13/fb/00/6c/bc/fb006cbc-d2e5-4fcb-9321-62b6385720d0/berger_cloonan_batch_7_objects/57/pages,false,2022-06-21T13:53:01.477000+00:00,"Hall, Victoria",England--Norwich,Paper,"Surface application; Paste; M4.D5.F3; Sidney E. Berger and Michele V. Cloonan purchased the sheet from Ian Harkness.; Section(s) from the Decorated and Decorative Paper Terms Thesaurus: VIII.G.3.a; Not signed; Stamped; Not stickered; Not embossed; [stamped in black ink on verso]: ""Victoria Marbling  HAND DECORATED PAPERS BY VICTORIA HALL, St. Mary's Works, Duke Street, Norwich, NR3 1QA ENGLAND Tel: 01603 76441""; [stamped in red ink on verso]: ""Copyright [copyright symbol] 1994, No unauthorized reproduction""; [stamped in black ink on verso]: ""Ian Harkness English Hand Marbled Papers, 214-869-9010, To Re-Order Quote Ref 3H34""",fedoraAdmin,art reproduction|Brush-manipulated paste papers,https://api.library.tamu.edu/fcrepo/rest/3b/6f/c3/25/3b6fc325-f6ca-41d8-b91e-8c5db3be8c13/fb/00/6c/bc/fb006cbc-d2e5-4fcb-9321-62b6385720d0/berger_cloonan_batch_7_objects,Paste papers,2022-06-21T13:53:01.477000+00:00,Berger-Cloonan #1082,In copyright; For more information see: http://rightsstatements.org/vocab/InC/1.0/,StillImage,reformatted digital,fedoraAdmin,https://api.library.tamu.edu/fcrepo/rest/3b/6f/c3/25/3b6fc325-f6ca-41d8-b91e-8c5db3be8c13/fb/00/6c/bc/fb006cbc-d2e5-4fcb-9321-62b6385720d0/berger_cloonan_batch_7_objects/57/pages/page_0/files/01082.jpg,,1990s,1994,Victoria Marbling
19,"1 sheet of green, yellow, red and white marbled paper; 19.50 x 27.50 in.",https://api.library.tamu.edu/fcrepo/rest/3b/6f/c3/25/3b6fc325-f6ca-41d8-b91e-8c5db3be8c13/fb/00/6c/bc/fb006cbc-d2e5-4fcb-9321-62b6385720d0/berger_cloonan_batch_7_objects/20/orderProxies|https://api.library.tamu.edu/fcrepo/rest/3b/6f/c3/25/3b6fc325-f6ca-41d8-b91e-8c5db3be8c13/fb/00/6c/bc/fb006cbc-d2e5-4fcb-9321-62b6385720d0/berger_cloonan_batch_7_objects/20/pages,false,2022-06-21T13:51:49.607000+00:00,"Breugel, Eva Van",Holland,Paper,"Surface application; Marbled; M5.D4.F1; Section(s) from the Decorated and Decorative Paper Terms Thesaurus: VIII.F.1; Signed; Stamped; Not stickered; Not embossed; [stamped in blue ink on verso]: ""EVA VAN BREUGEL""; [written in pencil on verso]: ""Eva van Breugel""",fedoraAdmin,Combed marbled papers|art reproduction|curl marbled paper,https://api.library.tamu.edu/fcrepo/rest/3b/6f/c3/25/3b6fc325-f6ca-41d8-b91e-8c5db3be8c13/fb/00/6c/bc/fb006cbc-d2e5-4fcb-9321-62b6385720d0/berger_cloonan_batch_7_objects,Marbled papers,2022-06-21T13:51:49.607000+00:00,Berger-Cloonan #19,In copyright; For more information see: http://rightsstatements.org/vocab/InC/1.0/,StillImage,reformatted digital,fedoraAdmin,https://api.library.tamu.edu/fcrepo/rest/3b/6f/c3/25/3b6fc325-f6ca-41d8-b91e-8c5db3be8c13/fb/00/6c/bc/fb006cbc-d2e5-4fcb-9321-62b6385720d0/berger_cloonan_batch_7_objects/20/pages/page_0/files/00019.jpg,M5.D4.F1.A,,,
1967,"1 sheet of pink, dark purple, brown and white paste paper; 17.50 x 25.00 in.",https://api.library.tamu.edu/fcrepo/rest/3b/6f/c3/25/3b6fc325-f6ca-41d8-b91e-8c5db3be8c13/fb/00/6c/bc/fb006cbc-d2e5-4fcb-9321-62b6385720d0/berger_cloonan_batch_7_objects/116/orderProxies|https://api.library.tamu.edu/fcrepo/rest/3b/6f/c3/25/3b6fc325-f6ca-41d8-b91e-8c5db3be8c13/fb/00/6c/bc/fb006cbc-d2e5-4fcb-9321-62b6385720d0/berger_cloonan_batch_7_objects/116/pages,false,2022-06-21T13:54:37.852000+00:00,"Hall, Victoria",England,Paper,"Surface application; Paste; M4.D5.F3; Lines of varying colors; Section(s) from the Decorated and Decorative Paper Terms Thesaurus: VIII.G.3.a; Not signed; [stamped in blue ink on verso]: ""Made in Japan"";Stamped; Not stickered; Not embossed; [stamped in black ink on verso]: ""Victoria Marbling  HAND DECORATED PAPERS BY VICTORIA HALL, St. Mary's Works, Duke Street, Norwich, NR3 1QA ENGLAND Tel: 01603 76441""; [stamped in red ink on verso]: ""Copyright [copyright symbol] 1995, No unauthorized reproduction""",fedoraAdmin,Brush-manipulated paste papers|art reproduction,https://api.library.tamu.edu/fcrepo/rest/3b/6f/c3/25/3b6fc325-f6ca-41d8-b91e-8c5db3be8c13/fb/00/6c/bc/fb006cbc-d2e5-4fcb-9321-62b6385720d0/berger_cloonan_batch_7_objects,Paste papers,2022-06-21T13:54:37.852000+00:00,Berger-Cloonan #1967,In copyright; For more information see: http://rightsstatements.org/vocab/InC/1.0/,StillImage,reformatted digital,fedoraAdmin,https://api.library.tamu.edu/fcrepo/rest/3b/6f/c3/25/3b6fc325-f6ca-41d8-b91e-8c5db3be8c13/fb/00/6c/bc/fb006cbc-d2e5-4fcb-9321-62b6385720d0/berger_cloonan_batch_7_objects/116/pages/page_0/files/01967.jpg,,1990s,1995,Victoria Marbling
1113,"1 sheet of red, green, yellow and light brown marbled paper; 20.25 x 25.25 in.",https://api.library.tamu.edu/fcrepo/rest/3b/6f/c3/25/3b6fc325-f6ca-41d8-b91e-8c5db3be8c13/fb/00/6c/bc/fb006cbc-d2e5-4fcb-9321-62b6385720d0/berger_cloonan_batch_7_objects/88/orderProxies|https://api.library.tamu.edu/fcrepo/rest/3b/6f/c3/25/3b6fc325-f6ca-41d8-b91e-8c5db3be8c13/fb/00/6c/bc/fb006cbc-d2e5-4fcb-9321-62b6385720d0/berger_cloonan_batch_7_objects/88/pages,false,2022-06-21T13:53:53.945000+00:00,"Cockerell, Douglas|Cockerell, Sydney Morris",England--Cambridge,Paper,"Surface application; Marbled; M4.D3.F7; Section(s) from the Decorated and Decorative Paper Terms Thesaurus: VIII.F.1; Not signed; Stamped; Not stickered; Not embossed; Douglas Cockerell and Sidney Cockerell, father and son, were both talented English marblers. They marbled beginning in the 1970s.; [stamped in black ink on verso]: [copyright symbol] COCKERELL 1996 BARTON CAMBRIDGE CB3 7AD ENGLAND Tel/Fax 01223 262430 NO UNAUTHORISED REPRODUCTION""; [written in blue ink on verso]: ""2nd""",fedoraAdmin,Combed marbled papers|art reproduction|curl marbled paper,https://api.library.tamu.edu/fcrepo/rest/3b/6f/c3/25/3b6fc325-f6ca-41d8-b91e-8c5db3be8c13/fb/00/6c/bc/fb006cbc-d2e5-4fcb-9321-62b6385720d0/berger_cloonan_batch_7_objects,Marbled papers,2022-06-21T13:53:53.945000+00:00,Berger-Cloonan #1113,In copyright; For more information see: http://rightsstatements.org/vocab/InC/1.0/,StillImage,reformatted digital,fedoraAdmin,https://api.library.tamu.edu/fcrepo/rest/3b/6f/c3/25/3b6fc325-f6ca-41d8-b91e-8c5db3be8c13/fb/00/6c/bc/fb006cbc-d2e5-4fcb-9321-62b6385720d0/berger_cloonan_batch_7_objects/88/pages/page_0/files/01113.jpg,,1990s,1996,Cockerell
5,"1 sheet of green, brown, black, cream and white marbled paper; 21.00 x 29.00 in.",https://api.library.tamu.edu/fcrepo/rest/3b/6f/c3/25/3b6fc325-f6ca-41d8-b91e-8c5db3be8c13/fb/00/6c/bc/fb006cbc-d2e5-4fcb-9321-62b6385720d0/berger_cloonan_batch_7_objects/6/pages|https://api.library.tamu.edu/fcrepo/rest/3b/6f/c3/25/3b6fc325-f6ca-41d8-b91e-8c5db3be8c13/fb/00/6c/bc/fb006cbc-d2e5-4fcb-9321-62b6385720d0/berger_cloonan_batch_7_objects/6/orderProxies,false,2022-06-21T13:51:54.236000+00:00,"Breugel, Eva Van",Holland,Paper,"Surface application; Marbled; M5.D4.F1; Paper very thin; Sidney E. Berger and Michele V. Cloonan purchased the sheet from Kathy Link in 2009. All papers purchased from Kathy Link originally came from the Bennington, Vermont bindery of Gerhard Gerlach and Kathryn (Posey) Gerlach (Kathy Link's parents). Michele V. Cloonan studied bookbinding under Kathryn (Posey) Gerlach.; Section(s) from the Decorated and Decorative Paper Terms Thesaurus: VIII.F.4.g; Signed; Not stamped; Not stickered; Not embossed; [written in pencil on verso]: ""Eva Van Breugel""",fedoraAdmin,Stormont marbled paper|art reproduction,https://api.library.tamu.edu/fcrepo/rest/3b/6f/c3/25/3b6fc325-f6ca-41d8-b91e-8c5db3be8c13/fb/00/6c/bc/fb006cbc-d2e5-4fcb-9321-62b6385720d0/berger_cloonan_batch_7_objects,Marbling (Bookbinding)|Marbled papers,2022-06-21T13:51:54.236000+00:00,Berger-Cloonan #5,In copyright; For more information see: http://rightsstatements.org/vocab/InC/1.0/,StillImage,reformatted digital,fedoraAdmin,https://api.library.tamu.edu/fcrepo/rest/3b/6f/c3/25/3b6fc325-f6ca-41d8-b91e-8c5db3be8c13/fb/00/6c/bc/fb006cbc-d2e5-4fcb-9321-62b6385720d0/berger_cloonan_batch_7_objects/6/pages/page_0/files/00005.jpg,M5.D4.F1.A,,,
3742,"1 sheet of green, red, orange, brown, black and cream marbled paper; 23.00 x 34.75 in.",https://api.library.tamu.edu/fcrepo/rest/3b/6f/c3/25/3b6fc325-f6ca-41d8-b91e-8c5db3be8c13/fb/00/6c/bc/fb006cbc-d2e5-4fcb-9321-62b6385720d0/berger_cloonan_batch_7_objects/121/pages|https://api.library.tamu.edu/fcrepo/rest/3b/6f/c3/25/3b6fc325-f6ca-41d8-b91e-8c5db3be8c13/fb/00/6c/bc/fb006cbc-d2e5-4fcb-9321-62b6385720d0/berger_cloonan_batch_7_objects/121/orderProxies,false,2022-06-21T13:54:51.302000+00:00,"Gail-White, Victoria",Hawaii,Paper,"Surface application; Marbled; M5.D4.F13; Underlying pattern is stone marbling; overlying pattern is bouquet marbling; Section(s) from the Decorated and Decorative Paper Terms Thesaurus: VIII.F.3; Signed; Not stamped; Creases in paper; 2.00 gouge along one edge of paper; ink on verso; [written in black ink on verso]: ""Victoria Gail-White""",fedoraAdmin,Over-marbled papers|marbled paper|art reproduction,https://api.library.tamu.edu/fcrepo/rest/3b/6f/c3/25/3b6fc325-f6ca-41d8-b91e-8c5db3be8c13/fb/00/6c/bc/fb006cbc-d2e5-4fcb-9321-62b6385720d0/berger_cloonan_batch_7_objects,Marbled papers,2022-06-21T13:54:51.302000+00:00,Berger-Cloonan #3742,In copyright; For more information see: http://rightsstatements.org/vocab/InC/1.0/,StillImage,reformatted digital,fedoraAdmin,https://api.library.tamu.edu/fcrepo/rest/3b/6f/c3/25/3b6fc325-f6ca-41d8-b91e-8c5db3be8c13/fb/00/6c/bc/fb006cbc-d2e5-4fcb-9321-62b6385720d0/berger_cloonan_batch_7_objects/121/pages/page_0/files/03742.jpg,,,,
1130,"1 sheet of gray, red, green, pink and white marbled paper; 20.25 x 25.25 in.",https://api.library.tamu.edu/fcrepo/rest/3b/6f/c3/25/3b6fc325-f6ca-41d8-b91e-8c5db3be8c13/fb/00/6c/bc/fb006cbc-d2e5-4fcb-9321-62b6385720d0/berger_cloonan_batch_7_objects/105/pages|https://api.library.tamu.edu/fcrepo/rest/3b/6f/c3/25/3b6fc325-f6ca-41d8-b91e-8c5db3be8c13/fb/00/6c/bc/fb006cbc-d2e5-4fcb-9321-62b6385720d0/berger_cloonan_batch_7_objects/105/orderProxies,false,2022-06-21T13:54:19.688000+00:00,"Cockerell, Douglas|Cockerell, Sydney Morris",England--Cambridge,Paper,"Surface application; Marbled; M4.D3.F7; Section(s) from the Decorated and Decorative Paper Terms Thesaurus: VIII.F.1; Not signed; Stamped; Not stickered; Not embossed; Douglas Cockerell and Sidney Cockerell, father and son, were both talented English marblers. They marbled beginning in the 1970s.; [stamped in black ink on verso]: [copyright symbol] COCKERELL 94 WIMPOLE ROAD BARTON CAMBRIDGE CB3 7AD ENGLAND Tel 01223 262430 QUALITY HAND MARBLED DESIGN NO UNAUTHORISED REPRODUCTION""; [stamped in black ink on verso]: ""COCKERELL MARBLED PAPERS *SECOND* HAND MARBLED DESIGN""",fedoraAdmin,Combed marbled papers|art reproduction|curl marbled paper,https://api.library.tamu.edu/fcrepo/rest/3b/6f/c3/25/3b6fc325-f6ca-41d8-b91e-8c5db3be8c13/fb/00/6c/bc/fb006cbc-d2e5-4fcb-9321-62b6385720d0/berger_cloonan_batch_7_objects,Marbled papers,2022-06-21T13:54:19.688000+00:00,Berger-Cloonan #1130,In copyright; For more information see: http://rightsstatements.org/vocab/InC/1.0/,StillImage,reformatted digital,fedoraAdmin,https://api.library.tamu.edu/fcrepo/rest/3b/6f/c3/25/3b6fc325-f6ca-41d8-b91e-8c5db3be8c13/fb/00/6c/bc/fb006cbc-d2e5-4fcb-9321-62b6385720d0/berger_cloonan_batch_7_objects/105/pages/page_0/files/01130.jpg,,,,Cockerell
1000,"1 sheet of light green, light blue, pink, white and light brown marbled paper; 15.50 x 17.25 (uneven edges) in.",https://api.library.tamu.edu/fcrepo/rest/3b/6f/c3/25/3b6fc325-f6ca-41d8-b91e-8c5db3be8c13/fb/00/6c/bc/fb006cbc-d2e5-4fcb-9321-62b6385720d0/berger_cloonan_batch_7_objects/42/orderProxies|https://api.library.tamu.edu/fcrepo/rest/3b/6f/c3/25/3b6fc325-f6ca-41d8-b91e-8c5db3be8c13/fb/00/6c/bc/fb006cbc-d2e5-4fcb-9321-62b6385720d0/berger_cloonan_batch_7_objects/42/pages,false,2022-06-21T13:52:28.942000+00:00,"Ozeum, Mr.",China--Xinjiang Uygur Zizhiqu,Paper,"Surface application; Marbled; M4.D5.F1; Muted colors; Mr. Ozeum donated the sheet to Sidney E. Berger and Michele V. Cloonan.; Section(s) from the Decorated and Decorative Paper Terms Thesaurus: VIII.F.4; Not signed; Stamped; Not stickered; Not embossed; #01000 and #01001 stored together in onion paper folder; sheet stapled to onion paper folder; [stamped in purple ink on paper folder] ""KHOTAN PAPER, Handmade and marbled, Xinjiang Uygur Autonomous Region PRC, CACAS, Central Asian Culture Art Society""; [stamped in purple ink on paper folder]: ""Limited Edition #all rights by OZEUM <uygur13@tnn.net>""",fedoraAdmin,Random marbled papers|marbled paper|art reproduction,https://api.library.tamu.edu/fcrepo/rest/3b/6f/c3/25/3b6fc325-f6ca-41d8-b91e-8c5db3be8c13/fb/00/6c/bc/fb006cbc-d2e5-4fcb-9321-62b6385720d0/berger_cloonan_batch_7_objects,Marbled papers,2022-06-21T13:52:28.942000+00:00,Berger-Cloonan #1000,In copyright; For more information see: http://rightsstatements.org/vocab/InC/1.0/,StillImage,reformatted digital,fedoraAdmin,https://api.library.tamu.edu/fcrepo/rest/3b/6f/c3/25/3b6fc325-f6ca-41d8-b91e-8c5db3be8c13/fb/00/6c/bc/fb006cbc-d2e5-4fcb-9321-62b6385720d0/berger_cloonan_batch_7_objects/42/pages/page_0/files/01000.jpg,M4.D5.F1.A,,,Central Asian Culture Art Society
1102,"1 sheet of pink, brown and white marbled paper; 20.25 x 25.25 in.",https://api.library.tamu.edu/fcrepo/rest/3b/6f/c3/25/3b6fc325-f6ca-41d8-b91e-8c5db3be8c13/fb/00/6c/bc/fb006cbc-d2e5-4fcb-9321-62b6385720d0/berger_cloonan_batch_7_objects/77/pages|https://api.library.tamu.edu/fcrepo/rest/3b/6f/c3/25/3b6fc325-f6ca-41d8-b91e-8c5db3be8c13/fb/00/6c/bc/fb006cbc-d2e5-4fcb-9321-62b6385720d0/berger_cloonan_batch_7_objects/77/orderProxies,false,2022-06-21T13:53:35.623000+00:00,"Cockerell, Douglas|Cockerell, Sydney Morris",England--Cambridge,Paper,"Surface application; Marbled; M4.D3.F7; Section(s) from the Decorated and Decorative Paper Terms Thesaurus: VIII.F.1; Not signed; Stamped; Not stickered; Not embossed; Douglas Cockerell and Sidney Cockerell, father and son, were both talented English marblers. They marbled beginning in the 1970s.; [stamped in black ink on verso]: [copyright symbol] COCKERELL 1996 BARTON CAMBRIDGE CB3 7AD ENGLAND Tel/Fax 01223 262430 NO UNAUTHORISED REPRODUCTION""; [written in black ink on verso]: ""2nd""",fedoraAdmin,art reproduction|Combed marbled papers|curl marbled paper,https://api.library.tamu.edu/fcrepo/rest/3b/6f/c3/25/3b6fc325-f6ca-41d8-b91e-8c5db3be8c13/fb/00/6c/bc/fb006cbc-d2e5-4fcb-9321-62b6385720d0/berger_cloonan_batch_7_objects,Marbled papers,2022-06-21T13:53:35.623000+00:00,Berger-Cloonan #1102,In copyright; For more information see: http://rightsstatements.org/vocab/InC/1.0/,StillImage,reformatted digital,fedoraAdmin,https://api.library.tamu.edu/fcrepo/rest/3b/6f/c3/25/3b6fc325-f6ca-41d8-b91e-8c5db3be8c13/fb/00/6c/bc/fb006cbc-d2e5-4fcb-9321-62b6385720d0/berger_cloonan_batch_7_objects/77/pages/page_0/files/01102.jpg,,1990s,1996,Cockerell
15,"1 sheet of brown, green, black, white, and light gray marbled paper; 19.00 x 24.75 in.",https://api.library.tamu.edu/fcrepo/rest/3b/6f/c3/25/3b6fc325-f6ca-41d8-b91e-8c5db3be8c13/fb/00/6c/bc/fb006cbc-d2e5-4fcb-9321-62b6385720d0/berger_cloonan_batch_7_objects/16/orderProxies|https://api.library.tamu.edu/fcrepo/rest/3b/6f/c3/25/3b6fc325-f6ca-41d8-b91e-8c5db3be8c13/fb/00/6c/bc/fb006cbc-d2e5-4fcb-9321-62b6385720d0/berger_cloonan_batch_7_objects/16/pages,false,2022-06-21T13:51:31.821000+00:00,"Breugel, Eva Van",Holland,Paper,"Distribution of fibers; Surface application; Laid; Watermarked; Marbled; M5.D4.F1; Paper has watermark of rooster and heraldic shield; laid paper; Section(s) from the Decorated and Decorative Paper Terms Thesaurus: II.E; II.H; VIII.F.1; Not signed; Stamped; Not stickered; Not embossed; [stamped in blue ink on verso]: ""EVA VAN BREUGEL""",fedoraAdmin,watermarks|art reproduction|Combed marbled papers|curl marbled paper,https://api.library.tamu.edu/fcrepo/rest/3b/6f/c3/25/3b6fc325-f6ca-41d8-b91e-8c5db3be8c13/fb/00/6c/bc/fb006cbc-d2e5-4fcb-9321-62b6385720d0/berger_cloonan_batch_7_objects,Marbled papers|Watermarks,2022-06-21T13:51:31.821000+00:00,Berger-Cloonan #15,In copyright; For more information see: http://rightsstatements.org/vocab/InC/1.0/,StillImage,reformatted digital,fedoraAdmin,https://api.library.tamu.edu/fcrepo/rest/3b/6f/c3/25/3b6fc325-f6ca-41d8-b91e-8c5db3be8c13/fb/00/6c/bc/fb006cbc-d2e5-4fcb-9321-62b6385720d0/berger_cloonan_batch_7_objects/16/pages/page_0/files/00015.jpg,M5.D4.F1.A,,,
992,1 sheet of light brown mottled-fiber paper; 14.25 x 16.25  in.,https://api.library.tamu.edu/fcrepo/rest/3b/6f/c3/25/3b6fc325-f6ca-41d8-b91e-8c5db3be8c13/fb/00/6c/bc/fb006cbc-d2e5-4fcb-9321-62b6385720d0/berger_cloonan_batch_7_objects/34/pages|https://api.library.tamu.edu/fcrepo/rest/3b/6f/c3/25/3b6fc325-f6ca-41d8-b91e-8c5db3be8c13/fb/00/6c/bc/fb006cbc-d2e5-4fcb-9321-62b6385720d0/berger_cloonan_batch_7_objects/34/orderProxies,false,2022-06-21T13:52:22.343000+00:00,,China--Xinjiang Uygur Zizhiqu,Paper,"Distribution of fibers; Mottled-fiber; M4.D5.F1; ""Dr. Sidney Berger""; written in calligraphic black script; handmade paper; Mr. Ozeum donated the sheet to Sidney E. Berger and Michele V. Cloonan.; Section(s) from the Decorated and Decorative Paper Terms Thesaurus: II.F; Not signed; Stamped; Not stickered; Not embossed; [stamped in red ink on recto]: ""illegible""; [stamped in black ink on verso]: ""KHOTAN PAPER, Handmade and marbled, Xinjiang Uygur Autonomous Region PRC, CACAS, Central Asian Culture Art Society""",fedoraAdmin,Mottled-fiber papers|art reproduction,https://api.library.tamu.edu/fcrepo/rest/3b/6f/c3/25/3b6fc325-f6ca-41d8-b91e-8c5db3be8c13/fb/00/6c/bc/fb006cbc-d2e5-4fcb-9321-62b6385720d0/berger_cloonan_batch_7_objects,Decorative paper,2022-06-21T13:52:22.343000+00:00,Berger-Cloonan #992,In copyright; For more information see: http://rightsstatements.org/vocab/InC/1.0/,StillImage,reformatted digital,fedoraAdmin,https://api.library.tamu.edu/fcrepo/rest/3b/6f/c3/25/3b6fc325-f6ca-41d8-b91e-8c5db3be8c13/fb/00/6c/bc/fb006cbc-d2e5-4fcb-9321-62b6385720d0/berger_cloonan_batch_7_objects/34/pages/page_0/files/00992.jpg,M4.D5.F1.A,,,Central Asian Culture Art Society
1135,"1 sheet of blue, green and white marbled paper; 20.25 x 25.25 in.",https://api.library.tamu.edu/fcrepo/rest/3b/6f/c3/25/3b6fc325-f6ca-41d8-b91e-8c5db3be8c13/fb/00/6c/bc/fb006cbc-d2e5-4fcb-9321-62b6385720d0/berger_cloonan_batch_7_objects/110/orderProxies|https://api.library.tamu.edu/fcrepo/rest/3b/6f/c3/25/3b6fc325-f6ca-41d8-b91e-8c5db3be8c13/fb/00/6c/bc/fb006cbc-d2e5-4fcb-9321-62b6385720d0/berger_cloonan_batch_7_objects/110/pages,false,2022-06-21T13:54:31.033000+00:00,"Cockerell, Sydney Morris|Cockerell, Douglas",England,Paper,"Surface application; Marbled; M4.D3.F7; Section(s) from the Decorated and Decorative Paper Terms Thesaurus: VIII.F.1; Not signed; Stamped; Not stickered; Not embossed; Douglas Cockerell and Sidney Cockerell, father and son, were both talented English marblers. They marbled beginning in the 1970s.; [stamped in black ink on verso]: [copyright symbol] COCKERELL 1996 BARTON CAMBRIDGE CB3 7AD ENGLAND Tel/Fax 01223 262430 NO UNAUTHORISED REPRODUCTION""; [stamped in black ink on verso]: ""FINEST ENGLISH HAND MARBLED DESIGN FROM THE COCKERELL STUDIO EST. OVER 80 YRS""",fedoraAdmin,art reproduction|Combed marbled papers|curl marbled paper,https://api.library.tamu.edu/fcrepo/rest/3b/6f/c3/25/3b6fc325-f6ca-41d8-b91e-8c5db3be8c13/fb/00/6c/bc/fb006cbc-d2e5-4fcb-9321-62b6385720d0/berger_cloonan_batch_7_objects,Marbled papers,2022-06-21T13:54:31.033000+00:00,Berger-Cloonan #1135,In copyright; For more information see: http://rightsstatements.org/vocab/InC/1.0/,StillImage,reformatted digital,fedoraAdmin,https://api.library.tamu.edu/fcrepo/rest/3b/6f/c3/25/3b6fc325-f6ca-41d8-b91e-8c5db3be8c13/fb/00/6c/bc/fb006cbc-d2e5-4fcb-9321-62b6385720d0/berger_cloonan_batch_7_objects/110/pages/page_0/files/01135.jpg,,1990s,1996,Cockerell
