dc_identifier,dcterms_extent,ldp_contains,fedora_writable,fedora_created,dc_creator,dcterms_spatial,dcterms_medium,tamudigital_local/details,fedora_lastModifiedBy,dc_type,fedora_hasParent,dc_subject,fedora_lastModified,dc_title,dc_rights,dcterms_type,dc_format,fedora_createdBy,files,dc_relation,dcterms_temporal,dcterms_created,dc_contributor
4364,"1 sheet of blue, green and gray marbled paper; 19.50 x 27.50 in.",https://api.library.tamu.edu/fcrepo/rest/3b/6f/c3/25/3b6fc325-f6ca-41d8-b91e-8c5db3be8c13/fb/00/6c/bc/fb006cbc-d2e5-4fcb-9321-62b6385720d0/berger_cloonan_batch_7_objects/125/orderProxies|https://api.library.tamu.edu/fcrepo/rest/3b/6f/c3/25/3b6fc325-f6ca-41d8-b91e-8c5db3be8c13/fb/00/6c/bc/fb006cbc-d2e5-4fcb-9321-62b6385720d0/berger_cloonan_batch_7_objects/125/pages,false,2022-06-21T13:54:56.529000+00:00,"Frigge, Karli",Netherlands,Paper,"Distribution of fibers; Surface application; Cast; Marbled; M4.D3.F4; Agate marble across center of gray cast paper with 2 gray borders creates runner effect; heavier weight paper; Section(s) from the Decorated and Decorative Paper Terms Thesaurus: II.A; VIII.F.4.f; Not signed; Stamped; Ink on verso; The Berger/Cloonan paper collection contains a large number of the works of Karli Frigge. Sidney E. Berger wrote Karli Frigge's Life in Marbling (Newtown, PA: Bird & Bull Press, 2004), in which he claims that Karli Frigge is perhaps the greatest marbler in history.; [stamped in blue ink on verso]: ""KARLI FRIGGE LOCHEMSEWEG 75 7215 RA JOPPE NEDERLAND [printed in an open square]""",fedoraAdmin,Stone marbled papers|Cast papers|art reproduction,https://api.library.tamu.edu/fcrepo/rest/3b/6f/c3/25/3b6fc325-f6ca-41d8-b91e-8c5db3be8c13/fb/00/6c/bc/fb006cbc-d2e5-4fcb-9321-62b6385720d0/berger_cloonan_batch_7_objects,Marbled papers,2022-06-21T13:54:56.529000+00:00,Berger-Cloonan #4364,In copyright; For more information see: http://rightsstatements.org/vocab/InC/1.0/,StillImage,reformatted digital,fedoraAdmin,https://api.library.tamu.edu/fcrepo/rest/3b/6f/c3/25/3b6fc325-f6ca-41d8-b91e-8c5db3be8c13/fb/00/6c/bc/fb006cbc-d2e5-4fcb-9321-62b6385720d0/berger_cloonan_batch_7_objects/125/pages/page_0/files/04364.jpg,,,,
12,"1 sheet of brown, blue, cream and white marbled paper; 19.00 x 24.75 in.",https://api.library.tamu.edu/fcrepo/rest/3b/6f/c3/25/3b6fc325-f6ca-41d8-b91e-8c5db3be8c13/fb/00/6c/bc/fb006cbc-d2e5-4fcb-9321-62b6385720d0/berger_cloonan_batch_7_objects/13/orderProxies|https://api.library.tamu.edu/fcrepo/rest/3b/6f/c3/25/3b6fc325-f6ca-41d8-b91e-8c5db3be8c13/fb/00/6c/bc/fb006cbc-d2e5-4fcb-9321-62b6385720d0/berger_cloonan_batch_7_objects/13/pages,false,2022-06-21T13:51:32.793000+00:00,"Breugel, Eva Van",Holland,Paper,"Distribution of fibers; Surface application; Laid; Watermarked; Marbled; M5.D4.F1; Paper has watermark of rooster and heraldic shield; laid paper; Section(s) from the Decorated and Decorative Paper Terms Thesaurus: II.E; II.H; VIII.F.4.g; Not signed; Stamped; Not stickered; Not embossed; [stamped in blue ink on verso]: ""Eva Clifford Kocq van Breugel, Driebergen Holland""; [written in pencil on verso]: ""Oct. 1992 [indecipherable German]=very thin agath marble with sunseed oil, burnt.""",fedoraAdmin,art reproduction|watermarks|Stormont marbled paper,https://api.library.tamu.edu/fcrepo/rest/3b/6f/c3/25/3b6fc325-f6ca-41d8-b91e-8c5db3be8c13/fb/00/6c/bc/fb006cbc-d2e5-4fcb-9321-62b6385720d0/berger_cloonan_batch_7_objects,Watermarks|Marbled papers,2022-06-21T13:51:32.793000+00:00,Berger-Cloonan #12,In copyright; For more information see: http://rightsstatements.org/vocab/InC/1.0/,StillImage,reformatted digital,fedoraAdmin,https://api.library.tamu.edu/fcrepo/rest/3b/6f/c3/25/3b6fc325-f6ca-41d8-b91e-8c5db3be8c13/fb/00/6c/bc/fb006cbc-d2e5-4fcb-9321-62b6385720d0/berger_cloonan_batch_7_objects/13/pages/page_0/files/00012.jpg,M5.D4.F1.A,1990s,1992-10 [?],
4476,"1 sheet of gray, blue, purple, black, red, white and cream marbled paper; 19.50 x 27.50 in.",https://api.library.tamu.edu/fcrepo/rest/3b/6f/c3/25/3b6fc325-f6ca-41d8-b91e-8c5db3be8c13/fb/00/6c/bc/fb006cbc-d2e5-4fcb-9321-62b6385720d0/berger_cloonan_batch_7_objects/142/pages|https://api.library.tamu.edu/fcrepo/rest/3b/6f/c3/25/3b6fc325-f6ca-41d8-b91e-8c5db3be8c13/fb/00/6c/bc/fb006cbc-d2e5-4fcb-9321-62b6385720d0/berger_cloonan_batch_7_objects/142/orderProxies,false,2022-06-21T13:55:25.418000+00:00,"Frigge, Karli",Netherlands,Paper,"Distribution of fibers; Surface application; Laid; Marbled; M4.D3.F4; Agate marble with cellular aspect and 6 nuclei or eyes with molecular design; laid paper; Section(s) from the Decorated and Decorative Paper Terms Thesaurus: II.E; VIII.F.4.f; Not signed; Stamped; Ink on verso; slightly curled; The Berger/Cloonan paper collection contains a large number of the works of Karli Frigge. Sidney E. Berger wrote Karli Frigge's Life in Marbling (Newtown, PA: Bird & Bull Press, 2004), in which he claims that Karli Frigge is perhaps the greatest marbler in history.; [stamped in black ink on verso]: ""KARLI FRIGGE LOCHEMSEWEG 75 7215 RA JOPPE NEDERLAND [printed in an open square]""",fedoraAdmin,Stone marbled papers|agate marbled paper|art reproduction,https://api.library.tamu.edu/fcrepo/rest/3b/6f/c3/25/3b6fc325-f6ca-41d8-b91e-8c5db3be8c13/fb/00/6c/bc/fb006cbc-d2e5-4fcb-9321-62b6385720d0/berger_cloonan_batch_7_objects,Marbled papers,2022-06-21T13:55:25.418000+00:00,Berger-Cloonan #4446,In copyright; For more information see: http://rightsstatements.org/vocab/InC/1.0/,StillImage,reformatted digital,fedoraAdmin,https://api.library.tamu.edu/fcrepo/rest/3b/6f/c3/25/3b6fc325-f6ca-41d8-b91e-8c5db3be8c13/fb/00/6c/bc/fb006cbc-d2e5-4fcb-9321-62b6385720d0/berger_cloonan_batch_7_objects/142/pages/page_0/files/04476.jpg,,,,
1134,"1 sheet of light blue, dark blue and white marbled paper; 20.25 x 25.25 in.",https://api.library.tamu.edu/fcrepo/rest/3b/6f/c3/25/3b6fc325-f6ca-41d8-b91e-8c5db3be8c13/fb/00/6c/bc/fb006cbc-d2e5-4fcb-9321-62b6385720d0/berger_cloonan_batch_7_objects/109/orderProxies|https://api.library.tamu.edu/fcrepo/rest/3b/6f/c3/25/3b6fc325-f6ca-41d8-b91e-8c5db3be8c13/fb/00/6c/bc/fb006cbc-d2e5-4fcb-9321-62b6385720d0/berger_cloonan_batch_7_objects/109/pages,false,2022-06-21T13:54:28.505000+00:00,"Cockerell, Sydney Morris|Cockerell, Douglas",England,Paper,"Surface application; Marbled; M4.D3.F7; Sidney E. Berger and Michele V. Cloonan purchased the sheet from Ian Harkness.; Section(s) from the Decorated and Decorative Paper Terms Thesaurus: VIII.F.1; Not signed; Stamped; Not stickered; Not embossed; Douglas Cockerell and Sidney Cockerell, father and son, were both talented English marblers. They marbled beginning in the 1970s.; [stamped in black ink on verso]: [copyright symbol] COCKERELL 1995 BARTON CAMBRIDGE CB3 7AD ENGLAND Tel/Fax 01223 262430 NO UNAUTHORISED REPRODUCTION""; [stamped in black ink on verso]: ""Ian Harkness English Hand Marbled Papers 214-859-9010 To Re-Order Quote Ref ___""; [written in pencil on verso]: ""Peter ___ + Marcus ____""",fedoraAdmin,Combed marbled papers|art reproduction|curl marbled paper,https://api.library.tamu.edu/fcrepo/rest/3b/6f/c3/25/3b6fc325-f6ca-41d8-b91e-8c5db3be8c13/fb/00/6c/bc/fb006cbc-d2e5-4fcb-9321-62b6385720d0/berger_cloonan_batch_7_objects,Marbled papers,2022-06-21T13:54:28.505000+00:00,Berger-Cloonan #1134,In copyright; For more information see: http://rightsstatements.org/vocab/InC/1.0/,StillImage,reformatted digital,fedoraAdmin,https://api.library.tamu.edu/fcrepo/rest/3b/6f/c3/25/3b6fc325-f6ca-41d8-b91e-8c5db3be8c13/fb/00/6c/bc/fb006cbc-d2e5-4fcb-9321-62b6385720d0/berger_cloonan_batch_7_objects/109/pages/page_0/files/01134.jpg,,1990s,1995,Cockerell
1004,"1 sheet of red, blue, white and light brown marbled paper; 15.50 x 17.50 (uneven edges) in.",https://api.library.tamu.edu/fcrepo/rest/3b/6f/c3/25/3b6fc325-f6ca-41d8-b91e-8c5db3be8c13/fb/00/6c/bc/fb006cbc-d2e5-4fcb-9321-62b6385720d0/berger_cloonan_batch_7_objects/46/pages|https://api.library.tamu.edu/fcrepo/rest/3b/6f/c3/25/3b6fc325-f6ca-41d8-b91e-8c5db3be8c13/fb/00/6c/bc/fb006cbc-d2e5-4fcb-9321-62b6385720d0/berger_cloonan_batch_7_objects/46/orderProxies,false,2022-06-21T13:52:41.582000+00:00,"Ozeum, Mr.",China--Xinjiang Uygur Zizhiqu,Paper,"Surface application; Marbled; M4.D5.F1; Mr. Ozeum donated the sheet to Sidney E. Berger and Michele V. Cloonan.; Section(s) from the Decorated and Decorative Paper Terms Thesaurus: VIII.F.1; Not signed; Stamped; Not stickered; Not embossed; #01004 and #01005 stored together in onion paper folder; sheet stapled to onion paper folder; [stamped in purple ink on paper folder] ""KHOTAN PAPER, Handmade and marbled, Xinjiang Uygur Autonomous Region PRC, CACAS, Central Asian Culture Art Society""; [stamped in purple ink on paper folder]: ""Limited Edition #all rights by OZEUM <uygur13@tnn.net>""",fedoraAdmin,Combed marbled papers|art reproduction|curl marbled paper,https://api.library.tamu.edu/fcrepo/rest/3b/6f/c3/25/3b6fc325-f6ca-41d8-b91e-8c5db3be8c13/fb/00/6c/bc/fb006cbc-d2e5-4fcb-9321-62b6385720d0/berger_cloonan_batch_7_objects,Marbled papers,2022-06-21T13:52:41.582000+00:00,Berger-Cloonan #1004,In copyright; For more information see: http://rightsstatements.org/vocab/InC/1.0/,StillImage,reformatted digital,fedoraAdmin,https://api.library.tamu.edu/fcrepo/rest/3b/6f/c3/25/3b6fc325-f6ca-41d8-b91e-8c5db3be8c13/fb/00/6c/bc/fb006cbc-d2e5-4fcb-9321-62b6385720d0/berger_cloonan_batch_7_objects/46/pages/page_0/files/01004.jpg,M4.D5.F1.A,,,Central Asian Culture Art Society
1088-001,"1 sheet of light brown, gray, black and white marbled paper; 20.25 x 25.25 in.",https://api.library.tamu.edu/fcrepo/rest/3b/6f/c3/25/3b6fc325-f6ca-41d8-b91e-8c5db3be8c13/fb/00/6c/bc/fb006cbc-d2e5-4fcb-9321-62b6385720d0/berger_cloonan_batch_7_objects/63/pages|https://api.library.tamu.edu/fcrepo/rest/3b/6f/c3/25/3b6fc325-f6ca-41d8-b91e-8c5db3be8c13/fb/00/6c/bc/fb006cbc-d2e5-4fcb-9321-62b6385720d0/berger_cloonan_batch_7_objects/63/orderProxies,false,2022-06-21T13:53:04.797000+00:00,"Cockerell, Douglas|Cockerell, Sydney Morris",England--Cambridge,Paper,"Surface application; Marbled; M4.D5.F4; Sidney E. Berger and Michele V. Cloonan purchased the sheet from the Paper Source in Los Angeles, California circa 1988.; Section(s) from the Decorated and Decorative Paper Terms Thesaurus: VIII.F.1; Not signed; Stamped; Not stickered; Not embossed; Douglas Cockerell and Sidney Cockerell, father and son, were both talented English marblers. They marbled beginning in the 1970s.; [stamped in black ink on verso]: [copyright symbol] COCKERELL33a PRIORY ROADCAMBRIDGE CB5 5HT1989""",fedoraAdmin,Combed marbled papers|art reproduction|curl marbled paper,https://api.library.tamu.edu/fcrepo/rest/3b/6f/c3/25/3b6fc325-f6ca-41d8-b91e-8c5db3be8c13/fb/00/6c/bc/fb006cbc-d2e5-4fcb-9321-62b6385720d0/berger_cloonan_batch_7_objects,Marbled papers,2022-06-21T13:53:04.797000+00:00,Berger-Cloonan #1088-001,In copyright; For more information see: http://rightsstatements.org/vocab/InC/1.0/,StillImage,reformatted digital,fedoraAdmin,https://api.library.tamu.edu/fcrepo/rest/3b/6f/c3/25/3b6fc325-f6ca-41d8-b91e-8c5db3be8c13/fb/00/6c/bc/fb006cbc-d2e5-4fcb-9321-62b6385720d0/berger_cloonan_batch_7_objects/63/pages/page_0/files/01088-001.jpg,M4.D5.F4.A,1980s,1989,Cockerell
1139,"1 sheet of red, brown, gray and white marbled paper; 5.75 x 19.00 in.",https://api.library.tamu.edu/fcrepo/rest/3b/6f/c3/25/3b6fc325-f6ca-41d8-b91e-8c5db3be8c13/fb/00/6c/bc/fb006cbc-d2e5-4fcb-9321-62b6385720d0/berger_cloonan_batch_7_objects/114/pages|https://api.library.tamu.edu/fcrepo/rest/3b/6f/c3/25/3b6fc325-f6ca-41d8-b91e-8c5db3be8c13/fb/00/6c/bc/fb006cbc-d2e5-4fcb-9321-62b6385720d0/berger_cloonan_batch_7_objects/114/orderProxies,false,2022-06-21T13:54:37.206000+00:00,"Cockerell, Douglas|Cockerell, Sydney Morris",England,Paper,"Surface application; Marbled; M4.D3.F7; Section(s) from the Decorated and Decorative Paper Terms Thesaurus: VIII.F.1.a; Not signed; Not stamped; Not stickered; Not embossed; Folded; Douglas Cockerell and Sidney Cockerell, father and son, were both talented English marblers. They marbled beginning in the 1970s.",fedoraAdmin,art reproduction|Bouquet marbled papers|curl marbled paper,https://api.library.tamu.edu/fcrepo/rest/3b/6f/c3/25/3b6fc325-f6ca-41d8-b91e-8c5db3be8c13/fb/00/6c/bc/fb006cbc-d2e5-4fcb-9321-62b6385720d0/berger_cloonan_batch_7_objects,Marbled papers,2022-06-21T13:54:37.206000+00:00,Berger-Cloonan #1139,In copyright; For more information see: http://rightsstatements.org/vocab/InC/1.0/,StillImage,reformatted digital,fedoraAdmin,https://api.library.tamu.edu/fcrepo/rest/3b/6f/c3/25/3b6fc325-f6ca-41d8-b91e-8c5db3be8c13/fb/00/6c/bc/fb006cbc-d2e5-4fcb-9321-62b6385720d0/berger_cloonan_batch_7_objects/114/pages/page_0/files/01139.jpg,,,,Cockerell
1009,"1 sheet of light blue, turquoise blue, dark blue, brown, gold and white marbled paper; 5.75 x 8.25  in.",https://api.library.tamu.edu/fcrepo/rest/3b/6f/c3/25/3b6fc325-f6ca-41d8-b91e-8c5db3be8c13/fb/00/6c/bc/fb006cbc-d2e5-4fcb-9321-62b6385720d0/berger_cloonan_batch_7_objects/51/orderProxies|https://api.library.tamu.edu/fcrepo/rest/3b/6f/c3/25/3b6fc325-f6ca-41d8-b91e-8c5db3be8c13/fb/00/6c/bc/fb006cbc-d2e5-4fcb-9321-62b6385720d0/berger_cloonan_batch_7_objects/51/pages,false,2022-06-21T13:52:45.386000+00:00,"Almaleh, Beki",Turkey--Istanbul,Paper,"Surface application; Marbled; M4.D5.F1; Slight metallic sheen; Section(s) from the Decorated and Decorative Paper Terms Thesaurus: VIII.F.1; Signed; Not stamped; Not stickered; Not embossed; #01008 and #01009 stored together in envelope; [written in black ink on recto]: ""Beki Almaleh""",fedoraAdmin,curl marbled paper|Combed marbled papers|art reproduction,https://api.library.tamu.edu/fcrepo/rest/3b/6f/c3/25/3b6fc325-f6ca-41d8-b91e-8c5db3be8c13/fb/00/6c/bc/fb006cbc-d2e5-4fcb-9321-62b6385720d0/berger_cloonan_batch_7_objects,Marbled papers,2022-06-21T13:52:45.386000+00:00,Berger-Cloonan #1009,In copyright; For more information see: http://rightsstatements.org/vocab/InC/1.0/,StillImage,reformatted digital,fedoraAdmin,https://api.library.tamu.edu/fcrepo/rest/3b/6f/c3/25/3b6fc325-f6ca-41d8-b91e-8c5db3be8c13/fb/00/6c/bc/fb006cbc-d2e5-4fcb-9321-62b6385720d0/berger_cloonan_batch_7_objects/51/pages/page_0/files/01009.jpg,M4.D5.F1.A,,,
1118,"1 sheet of blue, red, brown and white marbled paper; 20.25 x 25.25 in.",https://api.library.tamu.edu/fcrepo/rest/3b/6f/c3/25/3b6fc325-f6ca-41d8-b91e-8c5db3be8c13/fb/00/6c/bc/fb006cbc-d2e5-4fcb-9321-62b6385720d0/berger_cloonan_batch_7_objects/93/orderProxies|https://api.library.tamu.edu/fcrepo/rest/3b/6f/c3/25/3b6fc325-f6ca-41d8-b91e-8c5db3be8c13/fb/00/6c/bc/fb006cbc-d2e5-4fcb-9321-62b6385720d0/berger_cloonan_batch_7_objects/93/pages,false,2022-06-21T13:53:59.467000+00:00,"Cockerell, Douglas|Cockerell, Sydney Morris",England--Cambridge,Paper,"Surface application; Marbled; M4.D3.F7; Possibly not fully combed; regular pattern; Sidney E. Berger and Michele V. Cloonan purchased the sheet.; Section(s) from the Decorated and Decorative Paper Terms Thesaurus: VIII.F.1; Not signed; Stamped; Not stickered; Not embossed; Douglas Cockerell and Sidney Cockerell, father and son, were both talented English marblers. They marbled beginning in the 1970s. Sidney E. Berger and Michele V. Cloonan acquired several sheets that the dealer claimed were not fully combed patterns. They are rare experimental sheets.; [stamped in black ink on verso]: [copyright symbol] COCKERELL 1996 BARTON CAMBRIDGE CB3 7AD ENGLAND Tel/Fax 01223 262430 NO UNAUTHORISED REPRODUCTION""; [written in blue ink on verso]: ""2nd""",fedoraAdmin,Combed marbled papers|art reproduction|curl marbled paper,https://api.library.tamu.edu/fcrepo/rest/3b/6f/c3/25/3b6fc325-f6ca-41d8-b91e-8c5db3be8c13/fb/00/6c/bc/fb006cbc-d2e5-4fcb-9321-62b6385720d0/berger_cloonan_batch_7_objects,Marbled papers,2022-06-21T13:53:59.467000+00:00,Berger-Cloonan #1118,In copyright; For more information see: http://rightsstatements.org/vocab/InC/1.0/,StillImage,reformatted digital,fedoraAdmin,https://api.library.tamu.edu/fcrepo/rest/3b/6f/c3/25/3b6fc325-f6ca-41d8-b91e-8c5db3be8c13/fb/00/6c/bc/fb006cbc-d2e5-4fcb-9321-62b6385720d0/berger_cloonan_batch_7_objects/93/pages/page_0/files/01118.jpg,,1990s,1996,Cockerell
991,"1 sheet of light blue, green, yellow, red, maroon and white marbled paper; 10.00 x 13.75  in.",https://api.library.tamu.edu/fcrepo/rest/3b/6f/c3/25/3b6fc325-f6ca-41d8-b91e-8c5db3be8c13/fb/00/6c/bc/fb006cbc-d2e5-4fcb-9321-62b6385720d0/berger_cloonan_batch_7_objects/33/pages|https://api.library.tamu.edu/fcrepo/rest/3b/6f/c3/25/3b6fc325-f6ca-41d8-b91e-8c5db3be8c13/fb/00/6c/bc/fb006cbc-d2e5-4fcb-9321-62b6385720d0/berger_cloonan_batch_7_objects/33/orderProxies,false,2022-06-21T13:52:15.948000+00:00,"Yangoz, Hayreddin",,Paper,"Surface application; Marbled; M4.D5.F1; Central floral and leaf motif; background is stone marbling; Section(s) from the Decorated and Decorative Paper Terms Thesaurus: VIII.F.2; VIII.F.4.f; Signed; Not stamped; Not stickered; Not embossed; Stored in plastic sleeve; [written in black ink on recto]: ""H. Yangoz""",fedoraAdmin,art reproduction|Figured marbled papers|Stone marbled papers|agate marbled paper,https://api.library.tamu.edu/fcrepo/rest/3b/6f/c3/25/3b6fc325-f6ca-41d8-b91e-8c5db3be8c13/fb/00/6c/bc/fb006cbc-d2e5-4fcb-9321-62b6385720d0/berger_cloonan_batch_7_objects,Marbled papers,2022-06-21T13:52:15.948000+00:00,Berger-Cloonan #991,In copyright; For more information see: http://rightsstatements.org/vocab/InC/1.0/,StillImage,reformatted digital,fedoraAdmin,https://api.library.tamu.edu/fcrepo/rest/3b/6f/c3/25/3b6fc325-f6ca-41d8-b91e-8c5db3be8c13/fb/00/6c/bc/fb006cbc-d2e5-4fcb-9321-62b6385720d0/berger_cloonan_batch_7_objects/33/pages/page_0/files/00991.jpg,M4.D5.F1.A,,,
4420,"1 sheet of gray, pink, white and cream marbled paper; 19.50 x 27.50 in.",https://api.library.tamu.edu/fcrepo/rest/3b/6f/c3/25/3b6fc325-f6ca-41d8-b91e-8c5db3be8c13/fb/00/6c/bc/fb006cbc-d2e5-4fcb-9321-62b6385720d0/berger_cloonan_batch_7_objects/129/pages|https://api.library.tamu.edu/fcrepo/rest/3b/6f/c3/25/3b6fc325-f6ca-41d8-b91e-8c5db3be8c13/fb/00/6c/bc/fb006cbc-d2e5-4fcb-9321-62b6385720d0/berger_cloonan_batch_7_objects/129/orderProxies,false,2022-06-21T13:55:01.371000+00:00,"Frigge, Karli",Netherlands,Paper,"Distribution of fibers; Surface application; Laid; Marbled; M4.D3.F4; Agate marble with 6 large ""eyeball""; nuclei or (2 large, 2 medium and 2 small) spheres containing a range of abstract images; laid paper; Section(s) from the Decorated and Decorative Paper Terms Thesaurus: II.E; VIII.F.4.f; Not signed; Stamped; White gluey residue on verso; The Berger/Cloonan paper collection contains a large number of the works of Karli Frigge. Sidney E. Berger wrote Karli Frigge's Life in Marbling (Newtown, PA: Bird & Bull Press, 2004), in which he claims that Karli Frigge is perhaps the greatest marbler in history.; [stamped in black ink on verso]: ""KARLI FRIGGE LOCHEMSEWEG 75 7215 RA JOPPE NEDERLAND [printed in an open square]""",fedoraAdmin,Stone marbled papers|art reproduction,https://api.library.tamu.edu/fcrepo/rest/3b/6f/c3/25/3b6fc325-f6ca-41d8-b91e-8c5db3be8c13/fb/00/6c/bc/fb006cbc-d2e5-4fcb-9321-62b6385720d0/berger_cloonan_batch_7_objects,Marbled papers,2022-06-21T13:55:01.371000+00:00,Berger-Cloonan #4420,In copyright; For more information see: http://rightsstatements.org/vocab/InC/1.0/,StillImage,reformatted digital,fedoraAdmin,https://api.library.tamu.edu/fcrepo/rest/3b/6f/c3/25/3b6fc325-f6ca-41d8-b91e-8c5db3be8c13/fb/00/6c/bc/fb006cbc-d2e5-4fcb-9321-62b6385720d0/berger_cloonan_batch_7_objects/129/pages/page_0/files/04420.jpg,,,,
1091-001,"1 sheet of brown, gray, black and white marbled paper; 20.25 x 25.25 in.",https://api.library.tamu.edu/fcrepo/rest/3b/6f/c3/25/3b6fc325-f6ca-41d8-b91e-8c5db3be8c13/fb/00/6c/bc/fb006cbc-d2e5-4fcb-9321-62b6385720d0/berger_cloonan_batch_7_objects/66/pages|https://api.library.tamu.edu/fcrepo/rest/3b/6f/c3/25/3b6fc325-f6ca-41d8-b91e-8c5db3be8c13/fb/00/6c/bc/fb006cbc-d2e5-4fcb-9321-62b6385720d0/berger_cloonan_batch_7_objects/66/orderProxies,false,2022-06-21T13:53:15.272000+00:00,"Cockerell, Douglas|Cockerell, Sydney Morris",England,Paper,"Surface application; Marbled; M4.D5.F5; Sidney E. Berger and Michele V. Cloonan purchased the sheet from the Paper Source in Los Angeles, California circa 1988.; Section(s) from the Decorated and Decorative Paper Terms Thesaurus: VIII.F.1; Not signed; Not stamped; Not stickered; Not embossed; Douglas Cockerell and Sidney Cockerell, father and son, were both talented English marblers. They marbled beginning in the 1970s.",fedoraAdmin,Combed marbled papers|art reproduction|curl marbled paper,https://api.library.tamu.edu/fcrepo/rest/3b/6f/c3/25/3b6fc325-f6ca-41d8-b91e-8c5db3be8c13/fb/00/6c/bc/fb006cbc-d2e5-4fcb-9321-62b6385720d0/berger_cloonan_batch_7_objects,Marbled papers,2022-06-21T13:53:15.272000+00:00,Berger-Cloonan #1091-001,In copyright; For more information see: http://rightsstatements.org/vocab/InC/1.0/,StillImage,reformatted digital,fedoraAdmin,https://api.library.tamu.edu/fcrepo/rest/3b/6f/c3/25/3b6fc325-f6ca-41d8-b91e-8c5db3be8c13/fb/00/6c/bc/fb006cbc-d2e5-4fcb-9321-62b6385720d0/berger_cloonan_batch_7_objects/66/pages/page_0/files/01091-001.jpg,,,,Cockerell
8,"1 sheet of green, red, pink, brown, cream and white marbled paper; 19.50 x 23.00 in.",https://api.library.tamu.edu/fcrepo/rest/3b/6f/c3/25/3b6fc325-f6ca-41d8-b91e-8c5db3be8c13/fb/00/6c/bc/fb006cbc-d2e5-4fcb-9321-62b6385720d0/berger_cloonan_batch_7_objects/9/orderProxies|https://api.library.tamu.edu/fcrepo/rest/3b/6f/c3/25/3b6fc325-f6ca-41d8-b91e-8c5db3be8c13/fb/00/6c/bc/fb006cbc-d2e5-4fcb-9321-62b6385720d0/berger_cloonan_batch_7_objects/9/pages,false,2022-06-21T13:51:54.213000+00:00,"Breugel, Eva Van",Holland,Paper,"Surface application; Marbled; M5.D4.F1; Section(s) from the Decorated and Decorative Paper Terms Thesaurus: VIII.F.4; Not signed; Stamped; Not stickered; Not embossed; A small strip of thin paper with the same marbled pattern is clipped to the full sheet with a circular paper clip.; [stamped in blue ink on verso]: ""EVA VAN BREUGEL""",fedoraAdmin,Random marbled papers|marbled paper|art reproduction,https://api.library.tamu.edu/fcrepo/rest/3b/6f/c3/25/3b6fc325-f6ca-41d8-b91e-8c5db3be8c13/fb/00/6c/bc/fb006cbc-d2e5-4fcb-9321-62b6385720d0/berger_cloonan_batch_7_objects,Marbled papers,2022-06-21T13:51:54.213000+00:00,Berger-Cloonan #8,In copyright; For more information see: http://rightsstatements.org/vocab/InC/1.0/,StillImage,reformatted digital,fedoraAdmin,https://api.library.tamu.edu/fcrepo/rest/3b/6f/c3/25/3b6fc325-f6ca-41d8-b91e-8c5db3be8c13/fb/00/6c/bc/fb006cbc-d2e5-4fcb-9321-62b6385720d0/berger_cloonan_batch_7_objects/9/pages/page_0/files/00008.jpg,M5.D4.F1.A,,,
3H33|1080,1 sheet of dark blue and white paste paper; 17.50 x 25.00 in.,https://api.library.tamu.edu/fcrepo/rest/3b/6f/c3/25/3b6fc325-f6ca-41d8-b91e-8c5db3be8c13/fb/00/6c/bc/fb006cbc-d2e5-4fcb-9321-62b6385720d0/berger_cloonan_batch_7_objects/55/orderProxies|https://api.library.tamu.edu/fcrepo/rest/3b/6f/c3/25/3b6fc325-f6ca-41d8-b91e-8c5db3be8c13/fb/00/6c/bc/fb006cbc-d2e5-4fcb-9321-62b6385720d0/berger_cloonan_batch_7_objects/55/pages,false,2022-06-21T13:52:55.353000+00:00,"Hall, Victoria",England--Norwich,Paper,"Surface application; Paste; M4.D5.F3; Sidney E. Berger and Michele V. Cloonan purchased the sheet from Ian Harkness.; Section(s) from the Decorated and Decorative Paper Terms Thesaurus: VIII.G.2.a; Not signed; Stamped; Not stickered; Not embossed; [stamped in black ink on verso]: ""Victoria Marbling  HAND DECORATED PAPERS BY VICTORIA HALL, St. Mary's Works, Duke Street, Norwich, NR3 1QA ENGLAND Tel: 01603 76441""; [stamped in red ink on verso]: ""Copyright [copyright symbol] 1995, No unauthorized reproduction""; [stamped in black ink on verso]: ""Ian Harkness English Hand Marbled Papers, 214-869-9010, To Re-Order Quote Ref 3H33""",fedoraAdmin,Brushed paste papers|art reproduction,https://api.library.tamu.edu/fcrepo/rest/3b/6f/c3/25/3b6fc325-f6ca-41d8-b91e-8c5db3be8c13/fb/00/6c/bc/fb006cbc-d2e5-4fcb-9321-62b6385720d0/berger_cloonan_batch_7_objects,Paste papers,2022-06-21T13:52:55.353000+00:00,Berger-Cloonan #1080,In copyright; For more information see: http://rightsstatements.org/vocab/InC/1.0/,StillImage,reformatted digital,fedoraAdmin,https://api.library.tamu.edu/fcrepo/rest/3b/6f/c3/25/3b6fc325-f6ca-41d8-b91e-8c5db3be8c13/fb/00/6c/bc/fb006cbc-d2e5-4fcb-9321-62b6385720d0/berger_cloonan_batch_7_objects/55/pages/page_0/files/01080.jpg,,1990s,1995,Victoria Marbling
