dc_type,fedora_createdBy,dc_creator,fedora_hasParent,dc_rights,dc_contributor,fedora_lastModifiedBy,dcterms_extent,fedora_created,ldp_contains,dcterms_provenance,dc_title,dcterms_temporal,dc_subject,dcterms_isPartOf,dcterms_abstract,dcterms_created,dc_identifier,dcterms_type,fedora_lastModified,fedora_writable,files,dcterms_spatial,tamudigital_local/details,dc_description
Photographs,fedoraAdmin,,https://api.library.tamu.edu/fcrepo/rest/4a/7d/ff/c4/4a7dffc4-04ec-4e1f-8f9e-ac661b9f328d/cvm-batch-3_objects,In copyright - educational use permitted; see http://rightsstatements.org/vocab/InC-EDU/1.0/ for more information,Texas A & M University. College of Veterinary Medicine & Biomedical Sciences,fedoraAdmin,1 black-and -white print (photograph); 11.5X9mm,2023-02-17T17:16:12.333000+00:00,https://api.library.tamu.edu/fcrepo/rest/4a/7d/ff/c4/4a7dffc4-04ec-4e1f-8f9e-ac661b9f328d/cvm-batch-3_objects/167/pages|https://api.library.tamu.edu/fcrepo/rest/4a/7d/ff/c4/4a7dffc4-04ec-4e1f-8f9e-ac661b9f328d/cvm-batch-3_objects/167/orderProxies,,Equine Anesthesia at the Texas A&M College of Veterinary Medicine,,"Operating Rooms|Texas A & M University. College of Veterinary Medicine--Students|Teaching Rounds|Anesthesia|Education, Veterinary|Surgery Department, Hospital|Hospitals, Teaching|Surgery, Veterinary|Hospitals, Animal|Surgical instruments and apparatus|Horses|Large Animal Medicine and Surgery|Veterinary students",College of Veterinary Medicine Image Collection,A man in surgical dress and mask stands over a horse that is lying on an operating table. The horse is fitted with anesthesia equipment.,Between 1960 and 1980,0166,StillImage,2023-02-17T17:16:12.333000+00:00,false,https://api.library.tamu.edu/fcrepo/rest/4a/7d/ff/c4/4a7dffc4-04ec-4e1f-8f9e-ac661b9f328d/cvm-batch-3_objects/167/pages/page_0/files/CVM_0166.jpg,College Station|Texas,,
Photographs,fedoraAdmin,,https://api.library.tamu.edu/fcrepo/rest/4a/7d/ff/c4/4a7dffc4-04ec-4e1f-8f9e-ac661b9f328d/cvm-batch-3_objects,In copyright - educational use permitted; see http://rightsstatements.org/vocab/InC-EDU/1.0/ for more information,Texas A & M University. College of Veterinary Medicine & Biomedical Sciences,fedoraAdmin,1 black-and -white print (photograph); 12X17mm,2023-02-17T16:25:42.121000+00:00,https://api.library.tamu.edu/fcrepo/rest/4a/7d/ff/c4/4a7dffc4-04ec-4e1f-8f9e-ac661b9f328d/cvm-batch-3_objects/21/pages|https://api.library.tamu.edu/fcrepo/rest/4a/7d/ff/c4/4a7dffc4-04ec-4e1f-8f9e-ac661b9f328d/cvm-batch-3_objects/21/orderProxies,,"Hog Cholera Serum Production, number 4",,Vaccines|Swine|Cholera|Cholera--Vaccination|Swine-Virus diseases|Swine--Vaccination|Swine-Equipment and supplies|Veterinary laboratories|Blood|Swine Diseases|Serum|Veterinary medicine--History,College of Veterinary Medicine Image Collection,A man bends forward to inject a hog that is tied to a fence. The activity featured in this photograph took place in the anti-hog cholera serum laboratory that occupied the east wing of the veterinary hospital built in 1908 at the corner of Spence and Robert streets.  It was used for this purpose until 1917 when a new anti-hog serum laboratory was constructed on the corner of Roberts and Bizzell streets.,between 1905 and 1920,0020,StillImage,2023-02-17T16:25:42.121000+00:00,false,https://api.library.tamu.edu/fcrepo/rest/4a/7d/ff/c4/4a7dffc4-04ec-4e1f-8f9e-ac661b9f328d/cvm-batch-3_objects/21/pages/page_0/files/CVM_0020.jpg,Texas|College Station,"Written on photograph: ""Vaccine Lab.""",
Photographs,fedoraAdmin,"Golden, George E.",https://api.library.tamu.edu/fcrepo/rest/4a/7d/ff/c4/4a7dffc4-04ec-4e1f-8f9e-ac661b9f328d/cvm-batch-3_objects,In copyright - educational use permitted; see http://rightsstatements.org/vocab/InC-EDU/1.0/ for more information,Texas A & M University. College of Veterinary Medicine & Biomedical Sciences|United States. Department of Agriculture,fedoraAdmin,1 black-and -white print (photograph); 9X14.5mm,2023-02-17T16:55:22.611000+00:00,https://api.library.tamu.edu/fcrepo/rest/4a/7d/ff/c4/4a7dffc4-04ec-4e1f-8f9e-ac661b9f328d/cvm-batch-3_objects/104/pages|https://api.library.tamu.edu/fcrepo/rest/4a/7d/ff/c4/4a7dffc4-04ec-4e1f-8f9e-ac661b9f328d/cvm-batch-3_objects/104/orderProxies,"Written on photograph: ""This collection of kodak pictures, made by the late, Dr. Frank D. Porter in the course of his life work and interest with diseased animals is bequeathed to the library of Texas A&M College at his request, in the hope it will be of service and help to students in the pursuit of their career.  The pictures were made by Dr. F. D. Porter while on the Foot & Mouth disease in California in year of 1930 and in Houston in 1924.  And some were acquired from G. E. Golden. Dr. Frank D. Porter, Born-Indiana-1879, Died-Ft. Worth, TX-May 22, 1950.""","Frank D. Porter-Golden Foot & Mouth Collection, number 52",,"Mass burials|Euthanasia of animals|Animal Diseases|Porter, Frank D.--Photograph collections|Cattle--Carcasses|Foot-and-Mouth Disease",College of Veterinary Medicine Image Collection,Seven men prepare to burn cow carcasses that were infected by foot-and-mouth disease on a pile of wood. A tractor is in the right side of the frame and a truck is shown in the background.,Between 1924 and 1930,0102,StillImage,2023-02-17T16:55:22.611000+00:00,false,https://api.library.tamu.edu/fcrepo/rest/4a/7d/ff/c4/4a7dffc4-04ec-4e1f-8f9e-ac661b9f328d/cvm-batch-3_objects/104/pages/page_0/files/CVM_0102.jpg,,,
Portraits|Photographs,fedoraAdmin,,https://api.library.tamu.edu/fcrepo/rest/4a/7d/ff/c4/4a7dffc4-04ec-4e1f-8f9e-ac661b9f328d/cvm-batch-3_objects,In copyright - educational use permitted; see http://rightsstatements.org/vocab/InC-EDU/1.0/ for more information,Texas A & M University. College of Veterinary Medicine & Biomedical Sciences|A&M College Studio,fedoraAdmin,1 black-and -white print (photograph); 7X11.5mm,2023-02-17T17:04:12.886000+00:00,https://api.library.tamu.edu/fcrepo/rest/4a/7d/ff/c4/4a7dffc4-04ec-4e1f-8f9e-ac661b9f328d/cvm-batch-3_objects/131/orderProxies|https://api.library.tamu.edu/fcrepo/rest/4a/7d/ff/c4/4a7dffc4-04ec-4e1f-8f9e-ac661b9f328d/cvm-batch-3_objects/131/pages,"From a book of personal photographs given to Jerome Jackson Waters Jr. from John N. Olson; both of the graduating class of 1913, on the event of their 1938 class reunion. During this same year, Waters became an Instructor at the Illinois National Guard.  In 1941,  he became Commanding Officer of the Sixth Training Regiment.  From 1942 to 1944 he was appointed Commanding Officer Artillery 76th Division.  From 1944 to 1945, he was Commanding Officer Artillery XXXII Corps. Brig. Gen. Jerome J. Waters passed away in 1972.",Brunch at Bryan Country Club: an A&M College of Texas Class Reunion,1930s,"Waters, Jerome Jackson--Photograph collections|Class reunions|Civil engineers|Bryan (Tex.)|Olson, John N.|Agricultural and Mechanical College of Texas--Alumni and alumnae",College of Veterinary Medicine Image Collection,"In this reunion photograph taken at the Bryan Country Club, John N. Olson can be seen in a light suit and dark bow tie standing behind the right shoulder of the man in the dark suit just  right of center frame.",1938-06-04,0129,StillImage,2023-02-17T17:04:12.886000+00:00,false,https://api.library.tamu.edu/fcrepo/rest/4a/7d/ff/c4/4a7dffc4-04ec-4e1f-8f9e-ac661b9f328d/cvm-batch-3_objects/131/pages/page_0/files/CVM_0129.jpg,Texas|Bryan,,
Photographs,fedoraAdmin,,https://api.library.tamu.edu/fcrepo/rest/4a/7d/ff/c4/4a7dffc4-04ec-4e1f-8f9e-ac661b9f328d/cvm-batch-3_objects,In copyright - educational use permitted; see http://rightsstatements.org/vocab/InC-EDU/1.0/ for more information,Texas A & M University. College of Veterinary Medicine & Biomedical Sciences,fedoraAdmin,1 color print (photograph); 14.5X10mm,2023-02-17T18:23:43.676000+00:00,https://api.library.tamu.edu/fcrepo/rest/4a/7d/ff/c4/4a7dffc4-04ec-4e1f-8f9e-ac661b9f328d/cvm-batch-3_objects/366/orderProxies|https://api.library.tamu.edu/fcrepo/rest/4a/7d/ff/c4/4a7dffc4-04ec-4e1f-8f9e-ac661b9f328d/cvm-batch-3_objects/366/pages,,"Stevenson Companion Animal Life-Care Center Animals and Caregivers, number 08",,"Stevenson, Madlin|Pets|Texas A & M University. College of Veterinary Medicine--Benefactors|Animal housing|Dogs|Small Animal Medicine and Surgery|Human-animal relationships|Stevenson Companion Animal Life-Care Center|Pet medicine",College of Veterinary Medicine Image Collection,Madlin Stevenson sits on sofa at the Stevenson Companion Animal Life-Care Center with pug dog.  Mrs. Stevenson was the benefactor and namesake of the Center.,,0338,StillImage,2023-02-17T18:23:43.676000+00:00,false,https://api.library.tamu.edu/fcrepo/rest/4a/7d/ff/c4/4a7dffc4-04ec-4e1f-8f9e-ac661b9f328d/cvm-batch-3_objects/366/pages/page_0/files/CVM_0338.jpg,College Station|Texas,,
Photographs,fedoraAdmin,,https://api.library.tamu.edu/fcrepo/rest/4a/7d/ff/c4/4a7dffc4-04ec-4e1f-8f9e-ac661b9f328d/cvm-batch-3_objects,In copyright - educational use permitted; see http://rightsstatements.org/vocab/InC-EDU/1.0/ for more information,Texas A & M University. College of Veterinary Medicine & Biomedical Sciences,fedoraAdmin,1 black-and -white print (photograph),2023-02-17T17:11:32.291000+00:00,https://api.library.tamu.edu/fcrepo/rest/4a/7d/ff/c4/4a7dffc4-04ec-4e1f-8f9e-ac661b9f328d/cvm-batch-3_objects/153/pages|https://api.library.tamu.edu/fcrepo/rest/4a/7d/ff/c4/4a7dffc4-04ec-4e1f-8f9e-ac661b9f328d/cvm-batch-3_objects/153/orderProxies,,"Large Animal Clinicals at the A&M College of Texas, number 2",1930s,"Education, Veterinary|Hospitals, Teaching|Agricultural and Mechanical College of Texas. School of Veterinary Medicine--Students|Hospitals, Animal|Large Animal Medicine and Surgery|Horses|Veterinary students|Clinical Competence|Anatomy, Veterinary|Teaching Rounds|Physical Examination",College of Veterinary Medicine Image Collection,"Veterinary students in the Large Animal facility use hands-on learning in their discovery of animal anatomy.  In this photograph from the 1933 Longhorn Yearbook, nine students in white laboratory outfits examine an animal on a treatment table while others attend to horses.  A student at the end of the table is holding an equipment tray.",Between 1932 and 1933,0152,StillImage,2023-02-17T17:11:32.291000+00:00,false,https://api.library.tamu.edu/fcrepo/rest/4a/7d/ff/c4/4a7dffc4-04ec-4e1f-8f9e-ac661b9f328d/cvm-batch-3_objects/153/pages/page_0/files/CVM_0152.jpg,College Station|Texas,"Written on photograph: ""Large Animal Clinical Surgery""",
Photographs|Portraits,fedoraAdmin,,https://api.library.tamu.edu/fcrepo/rest/4a/7d/ff/c4/4a7dffc4-04ec-4e1f-8f9e-ac661b9f328d/cvm-batch-3_objects,In copyright - educational use permitted; see http://rightsstatements.org/vocab/InC-EDU/1.0/ for more information,Texas A & M University. College of Veterinary Medicine & Biomedical Sciences|Aggieland Studio,fedoraAdmin,1 black-and -white print (photograph); 20X25mm,2023-02-17T17:09:31.465000+00:00,https://api.library.tamu.edu/fcrepo/rest/4a/7d/ff/c4/4a7dffc4-04ec-4e1f-8f9e-ac661b9f328d/cvm-batch-3_objects/147/orderProxies|https://api.library.tamu.edu/fcrepo/rest/4a/7d/ff/c4/4a7dffc4-04ec-4e1f-8f9e-ac661b9f328d/cvm-batch-3_objects/147/pages,,"Junior Chapter of the American Veterinary Medicine Association, 1944",1940s,"Agricultural and Mechanical College of Texas. School of Veterinary Medicine--Faculty|American Veterinary Medical Association--Membership|College buildings|Hospitals, Teaching|Agricultural and Mechanical College of Texas. School of Veterinary Medicine--Students|Hospitals, Animal|Veterinary students|Historic buildings|Veterinary teachers|Hospital buildings",College of Veterinary Medicine Image Collection,A group portrait of students that were members of the Junior Chapter of the American Veterinary Medical Association (AVMA) at the A&M College  of Texas in 1944.  The group of men are wearing white laboratory attire.  One professor in a suit poses in front of an entrance to the Veterinary Hospital Building that was first occupied by the college in 1933.,1944,0146,StillImage,2023-02-17T17:09:31.465000+00:00,false,https://api.library.tamu.edu/fcrepo/rest/4a/7d/ff/c4/4a7dffc4-04ec-4e1f-8f9e-ac661b9f328d/cvm-batch-3_objects/147/pages/page_0/files/CVM_0146.jpg,College Station|Texas,,
Photographs,fedoraAdmin,,https://api.library.tamu.edu/fcrepo/rest/4a/7d/ff/c4/4a7dffc4-04ec-4e1f-8f9e-ac661b9f328d/cvm-batch-3_objects,In copyright - educational use permitted; see http://rightsstatements.org/vocab/InC-EDU/1.0/ for more information,Texas A & M University. College of Veterinary Medicine & Biomedical Sciences,fedoraAdmin,1 black-and -white print (photograph); 19.5X24mm,2023-02-17T17:22:29.112000+00:00,https://api.library.tamu.edu/fcrepo/rest/4a/7d/ff/c4/4a7dffc4-04ec-4e1f-8f9e-ac661b9f328d/cvm-batch-3_objects/186/pages|https://api.library.tamu.edu/fcrepo/rest/4a/7d/ff/c4/4a7dffc4-04ec-4e1f-8f9e-ac661b9f328d/cvm-batch-3_objects/186/orderProxies,,"Canine Procedure, number 2",,"Surgery, Veterinary|Hospitals, Animal|Clinical Competence|Veterinary students|Texas A & M University. College of Veterinary Medicine--Students|Teaching Rounds|Veterinary injections|Surgery Department, Hospital|Dogs|Small Animal Medicine and Surgery|Hospitals, Teaching",College of Veterinary Medicine Image Collection,"One man prepares an injection for either a surgical procedure or testing of a dog, while the other is making some other adjustments.",,0185,StillImage,2023-02-17T17:22:29.112000+00:00,false,https://api.library.tamu.edu/fcrepo/rest/4a/7d/ff/c4/4a7dffc4-04ec-4e1f-8f9e-ac661b9f328d/cvm-batch-3_objects/186/pages/page_0/files/CVM_0185.jpg,Texas|College Station,,
Photographs,fedoraAdmin,,https://api.library.tamu.edu/fcrepo/rest/4a/7d/ff/c4/4a7dffc4-04ec-4e1f-8f9e-ac661b9f328d/cvm-batch-3_objects,In copyright - educational use permitted; see http://rightsstatements.org/vocab/InC-EDU/1.0/ for more information,Texas A & M University. College of Veterinary Medicine & Biomedical Sciences,fedoraAdmin,1 black-and -white print (photograph); 12X16.5mm,2023-02-17T17:15:32.540000+00:00,https://api.library.tamu.edu/fcrepo/rest/4a/7d/ff/c4/4a7dffc4-04ec-4e1f-8f9e-ac661b9f328d/cvm-batch-3_objects/165/pages|https://api.library.tamu.edu/fcrepo/rest/4a/7d/ff/c4/4a7dffc4-04ec-4e1f-8f9e-ac661b9f328d/cvm-batch-3_objects/165/orderProxies,,Aquatic Animal Bacterial Study with a Catfish at Texas A&M,,"Austen, Jack D.|Laboratory Personnel|Fish Diseases|Bacteriology--Cultures and culture media|Zeman, James E.|Specimen Handling|Veterinary microbiology|Education, Veterinary|Catfishes|Aquatic animals|Veterinary faculty|Texas A & M University. College of Veterinary Medicine--Faculty|Lewis, Donald H.|Aquatic biology|Parasitology|Veterinary students|Texas A & M University. College of Veterinary Medicine--Students",College of Veterinary Medicine Image Collection,"A graduate student takes a sample from a diseased catfish in a laboratory while a research associate (standing behind him), and a professor (on the right) looks on.  From left to right: Jack D. Austen (graduate student in Veterinary Microbiology), James E. Zeman (research associate from the Department of Veterinary Microbiology), and Donald H. Lewis, (Ph.D., Assistant Professor of Veterinary Microbiology). In 1969, the College of Veterinary Medicine at Texas A&M University began to acquire and develop the expertise necessary to encompass aquatic animal medicine. At the time, it was one of the few veterinary colleges in the United States to conduct research and offer instruction on infectious and non-infectious diseases of marine mammals and of fish and shellfish, with special emphasis on marine species.",Between 1969 and 1980,0164,StillImage,2023-02-17T17:15:32.540000+00:00,false,https://api.library.tamu.edu/fcrepo/rest/4a/7d/ff/c4/4a7dffc4-04ec-4e1f-8f9e-ac661b9f328d/cvm-batch-3_objects/165/pages/page_0/files/CVM_0164.jpg,College Station|Texas,,
Photographs,fedoraAdmin,"Morgan, Beth",https://api.library.tamu.edu/fcrepo/rest/4a/7d/ff/c4/4a7dffc4-04ec-4e1f-8f9e-ac661b9f328d/cvm-batch-3_objects,In copyright - educational use permitted; see http://rightsstatements.org/vocab/InC-EDU/1.0/ for more information,Texas A & M University. College of Veterinary Medicine & Biomedical Sciences,fedoraAdmin,"1 color print (photograph); 16.5X24 mm, mounted",2023-02-17T17:59:24.925000+00:00,https://api.library.tamu.edu/fcrepo/rest/4a/7d/ff/c4/4a7dffc4-04ec-4e1f-8f9e-ac661b9f328d/cvm-batch-3_objects/294/orderProxies|https://api.library.tamu.edu/fcrepo/rest/4a/7d/ff/c4/4a7dffc4-04ec-4e1f-8f9e-ac661b9f328d/cvm-batch-3_objects/294/pages,,"Veterinary Research Building, number 5: Construction on West Side",1990s,College buildings|Texas A & M University. College of Veterinary Medicine--Buildings|Architecture|Veterinary laboratories|Building sites,College of Veterinary Medicine Image Collection,This photograph shows the progress that was made on construction of the new Research Building in January of 1992.  The west side of the skeletal structure that would become the Research Building is shown.  Its groundbreaking ceremony was held in 1991 and coincided with the 75th anniversary of the College of Veterinary Medicine & Biomedical Sciences.  This five-story building opened in 1993 and included an open atrium surrounded by four upper floors of Laboratory spaces.,1992-01,0019|0294,StillImage,2023-02-17T17:59:24.925000+00:00,false,https://api.library.tamu.edu/fcrepo/rest/4a/7d/ff/c4/4a7dffc4-04ec-4e1f-8f9e-ac661b9f328d/cvm-batch-3_objects/294/pages/page_0/files/CVM_0294.jpg,College Station|Texas,"Written on photograph: ""Construction Research Bldg- West side of BLDG. """,
Photographs,fedoraAdmin,,https://api.library.tamu.edu/fcrepo/rest/4a/7d/ff/c4/4a7dffc4-04ec-4e1f-8f9e-ac661b9f328d/cvm-batch-3_objects,In copyright - educational use permitted; see http://rightsstatements.org/vocab/InC-EDU/1.0/ for more information,Texas A & M University. College of Veterinary Medicine & Biomedical Sciences,fedoraAdmin,1 color print (photograph); 12.5X12.5 mm,2023-02-17T17:42:15.092000+00:00,https://api.library.tamu.edu/fcrepo/rest/4a/7d/ff/c4/4a7dffc4-04ec-4e1f-8f9e-ac661b9f328d/cvm-batch-3_objects/244/pages|https://api.library.tamu.edu/fcrepo/rest/4a/7d/ff/c4/4a7dffc4-04ec-4e1f-8f9e-ac661b9f328d/cvm-batch-3_objects/244/orderProxies,,"1974 Commencement Ceremony, number 8",1970s,College graduates|Commencement ceremonies|Special Events|Veterinary students|Texas A & M University. College of Veterinary Medicine--Students,College of Veterinary Medicine Image Collection,Veterinary Medicine graduates in caps and gowns stand in a dressing area. The man in center is facing away from the camera while a man who is not wearing regalia adjusts his collar or cravat.,1974,0244,StillImage,2023-02-17T17:42:15.092000+00:00,false,https://api.library.tamu.edu/fcrepo/rest/4a/7d/ff/c4/4a7dffc4-04ec-4e1f-8f9e-ac661b9f328d/cvm-batch-3_objects/244/pages/page_0/files/CVM_0244.jpg,College Station|Texas,"Written on photograph: ""August 1974 Commencement.""",
Photographs,fedoraAdmin,Holloman Air Force Base (N.M.). Photography Branch,https://api.library.tamu.edu/fcrepo/rest/4a/7d/ff/c4/4a7dffc4-04ec-4e1f-8f9e-ac661b9f328d/cvm-batch-3_objects,In copyright - educational use permitted; see http://rightsstatements.org/vocab/InC-EDU/1.0/ for more information,Texas A & M University. College of Veterinary Medicine & Biomedical Sciences,fedoraAdmin,1 black-and -white print (photograph); 24X19mm;  15X11mm,2023-02-17T17:29:56.746000+00:00,https://api.library.tamu.edu/fcrepo/rest/4a/7d/ff/c4/4a7dffc4-04ec-4e1f-8f9e-ac661b9f328d/cvm-batch-3_objects/208/orderProxies|https://api.library.tamu.edu/fcrepo/rest/4a/7d/ff/c4/4a7dffc4-04ec-4e1f-8f9e-ac661b9f328d/cvm-batch-3_objects/208/pages,,"Health Assessment of Space Chimpanzee ""Ham,"" number 2",1960s,"Texas A & M University. College of Medicine--Faculty|Diagnostic Tests, Routine|Animal space flight|Laboratory animals|Britz, William E.|Aerospace Medicine|Airmen|Veterinarians|Chimpanzees",College of Veterinary Medicine Image Collection,"""Elvis,"" the test chimpanzee, is being attended to following a thermal-humidity test by Dr. Bill Britz on the right and airman Cooper on the left.  Dr. Bill Britz was one of the veterinarians for ""Ham"" and assisted with the care of ""Elvis"" and the other test chimpanzees.",1960-03,0208,StillImage,2023-02-17T17:29:56.746000+00:00,false,https://api.library.tamu.edu/fcrepo/rest/4a/7d/ff/c4/4a7dffc4-04ec-4e1f-8f9e-ac661b9f328d/cvm-batch-3_objects/208/pages/page_0/files/CVM_0208.jpg,New Mexico,"Written on photograph: Airman Cooper, ""Elvis"", & Me?- Post Thermal- Humidity Test March 60",This photograph was taken at Holloman Air Force Base in New Mexico.
Photographs,fedoraAdmin,,https://api.library.tamu.edu/fcrepo/rest/4a/7d/ff/c4/4a7dffc4-04ec-4e1f-8f9e-ac661b9f328d/cvm-batch-3_objects,In copyright - educational use permitted; see http://rightsstatements.org/vocab/InC-EDU/1.0/ for more information,Texas A & M University. College of Veterinary Medicine & Biomedical Sciences,fedoraAdmin,1 color print (photograph); 12.5X12.5 mm,2023-02-17T17:41:35.497000+00:00,https://api.library.tamu.edu/fcrepo/rest/4a/7d/ff/c4/4a7dffc4-04ec-4e1f-8f9e-ac661b9f328d/cvm-batch-3_objects/242/pages|https://api.library.tamu.edu/fcrepo/rest/4a/7d/ff/c4/4a7dffc4-04ec-4e1f-8f9e-ac661b9f328d/cvm-batch-3_objects/242/orderProxies,,"1974 Commencement Ceremony, number 6",1970s,Veterinary students|Texas A & M University. College of Veterinary Medicine--Students|Women veterinary students|College graduates|Commencement ceremonies|Special Events,College of Veterinary Medicine Image Collection,Three female Veterinary Medicine graduates in caps and gowns. Two of them are seated with cigarettes.,1974,0242,StillImage,2023-02-17T17:41:35.497000+00:00,false,https://api.library.tamu.edu/fcrepo/rest/4a/7d/ff/c4/4a7dffc4-04ec-4e1f-8f9e-ac661b9f328d/cvm-batch-3_objects/242/pages/page_0/files/CVM_0242.jpg,College Station|Texas,"Written on photograph: ""August 1974 Commencement.""",
Photographs,fedoraAdmin,United States. National Aeronautics and Space Administration,https://api.library.tamu.edu/fcrepo/rest/4a/7d/ff/c4/4a7dffc4-04ec-4e1f-8f9e-ac661b9f328d/cvm-batch-3_objects,In copyright - educational use permitted; see http://rightsstatements.org/vocab/InC-EDU/1.0/ for more information,Texas A & M University. College of Veterinary Medicine & Biomedical Sciences,fedoraAdmin,"1 black-and -white print (photograph); 24X19mm; 15X11mm, 13X10mm negative",2023-02-17T17:29:15.270000+00:00,https://api.library.tamu.edu/fcrepo/rest/4a/7d/ff/c4/4a7dffc4-04ec-4e1f-8f9e-ac661b9f328d/cvm-batch-3_objects/206/pages|https://api.library.tamu.edu/fcrepo/rest/4a/7d/ff/c4/4a7dffc4-04ec-4e1f-8f9e-ac661b9f328d/cvm-batch-3_objects/206/orderProxies,,"Space Chimpanzee Enos's Capsule, the ""First Mate""",1960s,Outer space--Exploration|United States. National Aeronautics and Space Administration|Space Flight|Rockets (Aeronautics)|Animal space flight,College of Veterinary Medicine Image Collection,"A space capsule, ""First Mate,"" hangs from a cable or hook in preparation for the launch of the vehicle ""Atlas.""   The capsule contains ""Enos."" the second chimpanzee to be launched into space on November 29th 1961, and the first to achieve two orbits around the earth. After being brought from the Miami Rare Bird Farm on April 3, 1960 Enos completed more than 1,250 hours of training at the University of Kentucky and the Holloman Air Force Base. During the test flight they had two malfunctions. The capsule overheated and Enos received 76 electrical shocks from a malfunctioning ""avoidance conditioning"" test. On November 4, 1962 Enos died of shigellosis- related dysentery. His death was unrelated to his earth orbits on Mercury Atlas #5.",1961-11-02,0206,StillImage,2023-02-17T17:29:15.270000+00:00,false,https://api.library.tamu.edu/fcrepo/rest/4a/7d/ff/c4/4a7dffc4-04ec-4e1f-8f9e-ac661b9f328d/cvm-batch-3_objects/206/pages/page_0/files/CVM_0206.jpg,Florida|Cape Canaveral,"Written on photograph: ""Enos's Capsule- 1st Mate.  RCA INSPECTOR ACCEPTABLE. Erection of Mercury Capsule #9 on Pad 14, CCMTA. NASA/ MERCURY. LOD 61-9094 Enos's Capsule- 1st mate.""",
Photographs,fedoraAdmin,,https://api.library.tamu.edu/fcrepo/rest/4a/7d/ff/c4/4a7dffc4-04ec-4e1f-8f9e-ac661b9f328d/cvm-batch-3_objects,In copyright - educational use permitted; see http://rightsstatements.org/vocab/InC-EDU/1.0/ for more information,Texas A & M University. College of Veterinary Medicine & Biomedical Sciences,fedoraAdmin,1 color slide; 5X5mm slide,2023-02-17T18:25:24.164000+00:00,https://api.library.tamu.edu/fcrepo/rest/4a/7d/ff/c4/4a7dffc4-04ec-4e1f-8f9e-ac661b9f328d/cvm-batch-3_objects/371/pages|https://api.library.tamu.edu/fcrepo/rest/4a/7d/ff/c4/4a7dffc4-04ec-4e1f-8f9e-ac661b9f328d/cvm-batch-3_objects/371/orderProxies,,"Stevenson Companion Animal Life-Care Center Animals and Caregivers, number 13",1990s,"Greenbaum, Ellie|Animal housing|Small Animal Medicine and Surgery|Stevenson Companion Animal Life-Care Center|Pet medicine|Stevenson Companion Animal Life-Care Center--Employees|Pets",College of Veterinary Medicine Image Collection,"Ellie Greenbaum, Associate Director of the Stevenson Companion Animal Life-Care Center, answering the phone.",1999-05,0343,StillImage,2023-02-17T18:25:24.164000+00:00,false,https://api.library.tamu.edu/fcrepo/rest/4a/7d/ff/c4/4a7dffc4-04ec-4e1f-8f9e-ac661b9f328d/cvm-batch-3_objects/371/pages/page_0/files/CVM_0343.jpg,College Station|Texas,,
