dc_type,fedora_createdBy,dc_creator,fedora_hasParent,dc_rights,dc_contributor,fedora_lastModifiedBy,dcterms_extent,fedora_created,ldp_contains,dcterms_provenance,dc_title,dcterms_temporal,dc_subject,dcterms_isPartOf,dcterms_abstract,dcterms_created,dc_identifier,dcterms_type,fedora_lastModified,fedora_writable,files,dcterms_spatial,tamudigital_local/details,dc_description
Photographs,fedoraAdmin,"Wulfson, Jean",https://api.library.tamu.edu/fcrepo/rest/4a/7d/ff/c4/4a7dffc4-04ec-4e1f-8f9e-ac661b9f328d/cvm-batch-3_objects,In copyright - educational use permitted; see http://rightsstatements.org/vocab/InC-EDU/1.0/ for more information,Texas A & M University. College of Veterinary Medicine & Biomedical Sciences,fedoraAdmin,1 color print (photograph); 12.5X17.5mm,2023-02-17T18:07:41.005000+00:00,https://api.library.tamu.edu/fcrepo/rest/4a/7d/ff/c4/4a7dffc4-04ec-4e1f-8f9e-ac661b9f328d/cvm-batch-3_objects/318/pages|https://api.library.tamu.edu/fcrepo/rest/4a/7d/ff/c4/4a7dffc4-04ec-4e1f-8f9e-ac661b9f328d/cvm-batch-3_objects/318/orderProxies,,"Laura Bush speaks to Texas Folic Acid Council, number 07",1990s,"Special Events|Bush, Laura Welch, 1946-|Texas A & M University. College of Veterinary Medicine--Employees|Congenital Abnormalities|Texas Folic Acid Council|Prenatal care|Texas A & M University. Birth Defects Research Laboratory|Campus visits",College of Veterinary Medicine Image Collection,"Mrs. Laura Bush poses with five unidentified persons during her visit to the College of Veterinary Medicine's Birth Defects Research Lab in association with her ""Take Time for Kids"" campaign.  During this visit, she spoke to the Texas Folic Acid Council to encourage prenatal care in the prevention of birth defects and toured the campus.  The Birth Defects Research Lab, run by Dr. Richard Finnell, was a March of Dimes Grant recipient.",1999,0318,StillImage,2023-02-17T18:07:41.005000+00:00,false,https://api.library.tamu.edu/fcrepo/rest/4a/7d/ff/c4/4a7dffc4-04ec-4e1f-8f9e-ac661b9f328d/cvm-batch-3_objects/318/pages/page_0/files/CVM_0318.jpg,Texas|College Station,"Written on photograph: ""1999 Texas Folic Acid Council and Birth Defects research Laboratory visit.""",
Photographs,fedoraAdmin,"Golden, George E.",https://api.library.tamu.edu/fcrepo/rest/4a/7d/ff/c4/4a7dffc4-04ec-4e1f-8f9e-ac661b9f328d/cvm-batch-3_objects,In copyright - educational use permitted; see http://rightsstatements.org/vocab/InC-EDU/1.0/ for more information,Texas A & M University. College of Veterinary Medicine & Biomedical Sciences|United States. Department of Agriculture,fedoraAdmin,1 black-and -white print (photograph),2023-02-17T16:59:58.896000+00:00,https://api.library.tamu.edu/fcrepo/rest/4a/7d/ff/c4/4a7dffc4-04ec-4e1f-8f9e-ac661b9f328d/cvm-batch-3_objects/118/pages|https://api.library.tamu.edu/fcrepo/rest/4a/7d/ff/c4/4a7dffc4-04ec-4e1f-8f9e-ac661b9f328d/cvm-batch-3_objects/118/orderProxies,"Written on photograph: ""This collection of kodak pictures, made by the late, Dr. Frank D. Porter in the course of his life work and interest with diseased animals is bequeathed to the library of Texas A&M College at his request, in the hope it will be of service and help to students in the pursuit of their career.  The pictures were made by Dr. F. D. Porter while on the Foot & Mouth disease in California in year of 1930 and in Houston in 1924.  And some were acquired from G. E. Golden. Dr. Frank D. Porter, Born-Indiana-1879, Died-Ft. Worth, TX-May 22, 1950.""","Frank D. Porter-Golden Foot & Mouth Collection, number 66",,"Foot-and-Mouth Disease|Porter, Frank D.|Protective clothing|Animal Diseases|Automobiles|Veterinary services|Livestock--Inspection|Veterinarians|Disinfection and disinfectants|Agricultural and Mechanical College of Texas. School of Veterinary Medicine--Faculty|Porter, Frank D.--Photograph collections",College of Veterinary Medicine Image Collection,"Dr. Frank Porter stands in his protective gear next to his car after an inspection for foot-and-mouth disease in livestock.  A man kneels before him, disinfecting his gear.",Between 1924 and 1930,0116|0066,StillImage,2023-02-17T16:59:58.896000+00:00,false,https://api.library.tamu.edu/fcrepo/rest/4a/7d/ff/c4/4a7dffc4-04ec-4e1f-8f9e-ac661b9f328d/cvm-batch-3_objects/118/pages/page_0/files/CVM_0116.jpg,,,
Photographs,fedoraAdmin,,https://api.library.tamu.edu/fcrepo/rest/4a/7d/ff/c4/4a7dffc4-04ec-4e1f-8f9e-ac661b9f328d/cvm-batch-3_objects,In copyright - educational use permitted; see http://rightsstatements.org/vocab/InC-EDU/1.0/ for more information,Texas A & M University. College of Veterinary Medicine & Biomedical Sciences,fedoraAdmin,1 color negative; Kodak,2023-02-17T18:34:03.315000+00:00,https://api.library.tamu.edu/fcrepo/rest/4a/7d/ff/c4/4a7dffc4-04ec-4e1f-8f9e-ac661b9f328d/cvm-batch-3_objects/397/orderProxies|https://api.library.tamu.edu/fcrepo/rest/4a/7d/ff/c4/4a7dffc4-04ec-4e1f-8f9e-ac661b9f328d/cvm-batch-3_objects/397/pages,,"Ellie Greenbaum with Animals at the Stevenson Center, number 01",1990s,"Human-animal relationships|Stevenson Companion Animal Life-Care Center|Pet medicine|Stevenson Companion Animal Life-Care Center--Employees|Pets|Greenbaum, Ellie|Cats|Animal housing|Dogs|Small Animal Medicine and Surgery",College of Veterinary Medicine Image Collection,"Ellie Greenbaum (Associate Director of the Stevenson Companion Animal Life-Care Center) at her desk with residents canine ""Jill"" and feline ""Jessica.""  Jill the poodle was one of the Center's original pets when it first opened in 1994.  Jessica the cat arrived at the Center in December of 1998.",1999-09-14,0359-10,StillImage,2023-02-17T18:34:03.315000+00:00,false,https://api.library.tamu.edu/fcrepo/rest/4a/7d/ff/c4/4a7dffc4-04ec-4e1f-8f9e-ac661b9f328d/cvm-batch-3_objects/397/pages/page_0/files/CVM_0359-10.jpg,College Station|Texas,,
Photographs,fedoraAdmin,"Porter, Frank D.",https://api.library.tamu.edu/fcrepo/rest/4a/7d/ff/c4/4a7dffc4-04ec-4e1f-8f9e-ac661b9f328d/cvm-batch-3_objects,In copyright - educational use permitted; see http://rightsstatements.org/vocab/InC-EDU/1.0/ for more information,Texas A & M University. College of Veterinary Medicine & Biomedical Sciences|United States. Department of Agriculture,fedoraAdmin,1 black-and -white print (photograph); 9X14.5mm,2023-02-17T16:45:35.858000+00:00,https://api.library.tamu.edu/fcrepo/rest/4a/7d/ff/c4/4a7dffc4-04ec-4e1f-8f9e-ac661b9f328d/cvm-batch-3_objects/74/pages|https://api.library.tamu.edu/fcrepo/rest/4a/7d/ff/c4/4a7dffc4-04ec-4e1f-8f9e-ac661b9f328d/cvm-batch-3_objects/74/orderProxies,"Written on photograph: ""This collection of kodak pictures, made by the late, Dr. Frank D. Porter in the course of his life work and interest with diseased animals is bequeathed to the library of Texas A&M College at his request, in the hope it will be of service and help to students in the pursuit of their career.  The pictures were made by Dr. F. D. Porter while on the Foot & Mouth disease in California in year of 1930 and in Houston in 1924.  And some were acquired from G. E. Golden. Dr. Frank D. Porter, Born-Indiana-1879, Died-Ft. Worth, TX-May 22, 1950.""","Frank D. Porter-Golden  Foot & Mouth Collection, number 22",Between 1924 and 1930,"Foot-and-Mouth Disease|Cows|Corrals|Animal Diseases|Porter, Frank D.--Photograph collections",College of Veterinary Medicine Image Collection,Close-up of light colored cow inside a corral with discharge coming from its mouth due to foot-and-mouth disease.,Between 1924 and 1930,0072,StillImage,2023-02-17T16:45:35.858000+00:00,false,https://api.library.tamu.edu/fcrepo/rest/4a/7d/ff/c4/4a7dffc4-04ec-4e1f-8f9e-ac661b9f328d/cvm-batch-3_objects/74/pages/page_0/files/CVM_0072.jpg,,,
Photographs,fedoraAdmin,,https://api.library.tamu.edu/fcrepo/rest/4a/7d/ff/c4/4a7dffc4-04ec-4e1f-8f9e-ac661b9f328d/cvm-batch-3_objects,In copyright - educational use permitted; see http://rightsstatements.org/vocab/InC-EDU/1.0/ for more information,Texas A & M University. College of Veterinary Medicine & Biomedical Sciences,fedoraAdmin,1 black-and -white print (photograph); 19.5X24mm,2023-02-17T17:24:29.932000+00:00,https://api.library.tamu.edu/fcrepo/rest/4a/7d/ff/c4/4a7dffc4-04ec-4e1f-8f9e-ac661b9f328d/cvm-batch-3_objects/192/pages|https://api.library.tamu.edu/fcrepo/rest/4a/7d/ff/c4/4a7dffc4-04ec-4e1f-8f9e-ac661b9f328d/cvm-batch-3_objects/192/orderProxies,,"Poultry Science, number 2",,"Teaching Rounds|Education, Veterinary|Eggs--Production|Hospitals, Teaching|Poultry Science|Texas A & M University. College of Veterinary Medicine--Faculty|Hospitals, Animal|Veterinary students|Texas A & M University. College of Veterinary Medicine--Students|Chickens|Veterinary teachers",College of Veterinary Medicine Image Collection,A group of eight students and their instructor look at chickens in cages.,,0192,StillImage,2023-02-17T17:24:29.932000+00:00,false,https://api.library.tamu.edu/fcrepo/rest/4a/7d/ff/c4/4a7dffc4-04ec-4e1f-8f9e-ac661b9f328d/cvm-batch-3_objects/192/pages/page_0/files/CVM_0192.jpg,College Station|Texas,,
Photographs,fedoraAdmin,,https://api.library.tamu.edu/fcrepo/rest/4a/7d/ff/c4/4a7dffc4-04ec-4e1f-8f9e-ac661b9f328d/cvm-batch-3_objects,In copyright - educational use permitted; see http://rightsstatements.org/vocab/InC-EDU/1.0/ for more information,Texas A & M University. College of Veterinary Medicine & Biomedical Sciences,fedoraAdmin,1 black-and -white negative,2023-02-17T18:15:17.883000+00:00,https://api.library.tamu.edu/fcrepo/rest/4a/7d/ff/c4/4a7dffc4-04ec-4e1f-8f9e-ac661b9f328d/cvm-batch-3_objects/341/pages|https://api.library.tamu.edu/fcrepo/rest/4a/7d/ff/c4/4a7dffc4-04ec-4e1f-8f9e-ac661b9f328d/cvm-batch-3_objects/341/orderProxies,,"Small Animal Clinic Entrance, number 24",1990s,"Hospital buildings|Small Animal Clinic|Texas A & M University. College of Veterinary Medicine--Buildings|Hospitals, Teaching|Hospitals, Animal|Pet medicine",College of Veterinary Medicine Image Collection,A view of the steps leading up to the front doors of the Small Animal Clinic.,1999-06-14,0321-24,StillImage,2023-02-17T18:15:17.883000+00:00,false,https://api.library.tamu.edu/fcrepo/rest/4a/7d/ff/c4/4a7dffc4-04ec-4e1f-8f9e-ac661b9f328d/cvm-batch-3_objects/341/pages/page_0/files/CVM_0321-24.jpg,College Station|Texas,,
Photographs,fedoraAdmin,"Golden, George E.",https://api.library.tamu.edu/fcrepo/rest/4a/7d/ff/c4/4a7dffc4-04ec-4e1f-8f9e-ac661b9f328d/cvm-batch-3_objects,In copyright - educational use permitted; see http://rightsstatements.org/vocab/InC-EDU/1.0/ for more information,United States. Department of Agriculture|Texas A & M University. College of Veterinary Medicine & Biomedical Sciences,fedoraAdmin,1 black-and -white print (photograph); 9X14.5mm,2023-02-17T16:43:38.254000+00:00,https://api.library.tamu.edu/fcrepo/rest/4a/7d/ff/c4/4a7dffc4-04ec-4e1f-8f9e-ac661b9f328d/cvm-batch-3_objects/68/orderProxies|https://api.library.tamu.edu/fcrepo/rest/4a/7d/ff/c4/4a7dffc4-04ec-4e1f-8f9e-ac661b9f328d/cvm-batch-3_objects/68/pages,"Written on photograph: ""This collection of kodak pictures, made by the late, Dr. Frank D. Porter in the course of his life work and interest with diseased animals is bequeathed to the library of Texas A&M College at his request, in the hope it will be of service and help to students in the pursuit of their career.  The pictures were made by Dr. F. D. Porter while on the Foot & Mouth disease in California in year of 1930 and in Houston in 1924.  And some were acquired from G. E. Golden. Dr. Frank D. Porter, Born-Indiana-1879, Died-Ft. Worth, TX-May 22, 1950.""","Frank D. Porter-Golden Foot & Mouth Collection, number 16",,"Corrals|Cattle herding|Livestock--Inspection|Porter, Frank D.--Photograph collections|Cows",College of Veterinary Medicine Image Collection,Six men with a herd of cows. One man on horseback and other on the fence.,Between 1924 and 1930,0066,StillImage,2023-02-17T16:43:38.254000+00:00,false,https://api.library.tamu.edu/fcrepo/rest/4a/7d/ff/c4/4a7dffc4-04ec-4e1f-8f9e-ac661b9f328d/cvm-batch-3_objects/68/pages/page_0/files/CVM_0066.jpg,,,
Photographs,fedoraAdmin,"Golden, George E.",https://api.library.tamu.edu/fcrepo/rest/4a/7d/ff/c4/4a7dffc4-04ec-4e1f-8f9e-ac661b9f328d/cvm-batch-3_objects,In copyright - educational use permitted; see http://rightsstatements.org/vocab/InC-EDU/1.0/ for more information,Texas A & M University. College of Veterinary Medicine & Biomedical Sciences|United States. Department of Agriculture,fedoraAdmin,1 black-and -white print (photograph); 9X14.5mm,2023-02-17T16:49:31.001000+00:00,https://api.library.tamu.edu/fcrepo/rest/4a/7d/ff/c4/4a7dffc4-04ec-4e1f-8f9e-ac661b9f328d/cvm-batch-3_objects/86/orderProxies|https://api.library.tamu.edu/fcrepo/rest/4a/7d/ff/c4/4a7dffc4-04ec-4e1f-8f9e-ac661b9f328d/cvm-batch-3_objects/86/pages,"Written on photograph: ""This collection of kodak pictures, made by the late, Dr. Frank D. Porter in the course of his life work and interest with diseased animals is bequeathed to the library of Texas A&M College at his request, in the hope it will be of service and help to students in the pursuit of their career.  The pictures were made by Dr. F. D. Porter while on the Foot & Mouth disease in California in year of 1930 and in Houston in 1924.  And some were acquired from G. E. Golden. Dr. Frank D. Porter, Born-Indiana-1879, Died-Ft. Worth, TX-May 22, 1950.""","Frank D. Porter-Golden  Foot & Mouth Collection, number 34",,"Porter, Frank D.--Photograph collections|Foot-and-Mouth Disease|Cows|Animal Diseases|Livestock--Inspection",College of Veterinary Medicine Image Collection,A man in protective gear restrains the heads of two cows that show the characteristic drool from foot-and-mouth disease. This picture was taken 15 minutes before the were euthanized.,Between 1924 and 1930,0084,StillImage,2023-02-17T16:49:31.001000+00:00,false,https://api.library.tamu.edu/fcrepo/rest/4a/7d/ff/c4/4a7dffc4-04ec-4e1f-8f9e-ac661b9f328d/cvm-batch-3_objects/86/pages/page_0/files/CVM_0084.jpg,,,
Photographs,fedoraAdmin,,https://api.library.tamu.edu/fcrepo/rest/4a/7d/ff/c4/4a7dffc4-04ec-4e1f-8f9e-ac661b9f328d/cvm-batch-3_objects,In copyright - educational use permitted; see http://rightsstatements.org/vocab/InC-EDU/1.0/ for more information,Texas A & M University. College of Veterinary Medicine & Biomedical Sciences,fedoraAdmin,1 black-and -white print (photograph); 12.5X18mm,2023-02-17T16:31:43.640000+00:00,https://api.library.tamu.edu/fcrepo/rest/4a/7d/ff/c4/4a7dffc4-04ec-4e1f-8f9e-ac661b9f328d/cvm-batch-3_objects/32/orderProxies|https://api.library.tamu.edu/fcrepo/rest/4a/7d/ff/c4/4a7dffc4-04ec-4e1f-8f9e-ac661b9f328d/cvm-batch-3_objects/32/pages,,"Francis Hall, number 3: View of the Front Exterior",,Historic buildings|Agricultural and Mechanical College of Texas. School of Veterinary Medicine--Buildings|Francis Hall|College buildings,College of Veterinary Medicine Image Collection,A view of the front of Francis Hall.,Between 1918 and 1925,0031,StillImage,2023-02-17T16:31:43.640000+00:00,false,https://api.library.tamu.edu/fcrepo/rest/4a/7d/ff/c4/4a7dffc4-04ec-4e1f-8f9e-ac661b9f328d/cvm-batch-3_objects/32/pages/page_0/files/CVM_0031.jpg,College Station|Texas,,
Photographs,fedoraAdmin,,https://api.library.tamu.edu/fcrepo/rest/4a/7d/ff/c4/4a7dffc4-04ec-4e1f-8f9e-ac661b9f328d/cvm-batch-3_objects,In copyright - educational use permitted; see http://rightsstatements.org/vocab/InC-EDU/1.0/ for more information,Texas A & M University. College of Veterinary Medicine & Biomedical Sciences,fedoraAdmin,1 black-and -white print (photograph),2023-02-17T16:37:46.107000+00:00,https://api.library.tamu.edu/fcrepo/rest/4a/7d/ff/c4/4a7dffc4-04ec-4e1f-8f9e-ac661b9f328d/cvm-batch-3_objects/50/pages|https://api.library.tamu.edu/fcrepo/rest/4a/7d/ff/c4/4a7dffc4-04ec-4e1f-8f9e-ac661b9f328d/cvm-batch-3_objects/50/orderProxies,,Early Days of Downtown Bryan,1910s,Street life--Texas--Bryan|Historic buildings|Bryan (Tex.)|Cities and towns,College of Veterinary Medicine Image Collection,"A busy scene of Main Street in downtown Bryan, Texas, circa 1910, with lamp posts.  One automobile is depicted in the lower left corner of the photograph with a Bell telephone sign on the electrical pole to its left.  The telephone system was first installed in downtown Bryan in 1918. Among the businesses depicted in the photograph (starting at the far right side of main street) are: A.S. Parker (a hardware store),  J.W. Haswell, W.J. Coulter, and a store selling wall paper and paints.",1910?,0069|0049,StillImage,2023-02-17T16:37:46.107000+00:00,false,https://api.library.tamu.edu/fcrepo/rest/4a/7d/ff/c4/4a7dffc4-04ec-4e1f-8f9e-ac661b9f328d/cvm-batch-3_objects/50/pages/page_0/files/CVM_0049.jpg,Bryan|Texas,,
Photographs,fedoraAdmin,"Golden, George E.",https://api.library.tamu.edu/fcrepo/rest/4a/7d/ff/c4/4a7dffc4-04ec-4e1f-8f9e-ac661b9f328d/cvm-batch-3_objects,In copyright - educational use permitted; see http://rightsstatements.org/vocab/InC-EDU/1.0/ for more information,United States. Department of Agriculture|Texas A & M University. College of Veterinary Medicine & Biomedical Sciences,fedoraAdmin,1 black-and -white print (photograph); 9X14.5mm,2023-02-17T16:58:58.641000+00:00,https://api.library.tamu.edu/fcrepo/rest/4a/7d/ff/c4/4a7dffc4-04ec-4e1f-8f9e-ac661b9f328d/cvm-batch-3_objects/115/pages|https://api.library.tamu.edu/fcrepo/rest/4a/7d/ff/c4/4a7dffc4-04ec-4e1f-8f9e-ac661b9f328d/cvm-batch-3_objects/115/orderProxies,"Written on photograph: ""This collection of kodak pictures, made by the late, Dr. Frank D. Porter in the course of his life work and interest with diseased animals is bequeathed to the library of Texas A&M College at his request, in the hope it will be of service and help to students in the pursuit of their career.  The pictures were made by Dr. F. D. Porter while on the Foot & Mouth disease in California in year of 1930 and in Houston in 1924.  And some were acquired from G. E. Golden. Dr. Frank D. Porter, Born-Indiana-1879, Died-Ft. Worth, TX-May 22, 1950.""","Frank D. Porter-Golden  Foot & Mouth Collection, number 63",,"Animal Diseases|Veterinary services|Cattle dip|Porter, Frank D.--Photograph collections|Foot-and-Mouth Disease",College of Veterinary Medicine Image Collection,Cattle are treated for diseases by means of a chute that leads cattle down into a trench for dipping. A cow is shown down in dipping solution in this image.,Between 1924 and 1930,0113,StillImage,2023-02-17T16:58:58.641000+00:00,false,https://api.library.tamu.edu/fcrepo/rest/4a/7d/ff/c4/4a7dffc4-04ec-4e1f-8f9e-ac661b9f328d/cvm-batch-3_objects/115/pages/page_0/files/CVM_0113.jpg,,,
Photographs,fedoraAdmin,,https://api.library.tamu.edu/fcrepo/rest/4a/7d/ff/c4/4a7dffc4-04ec-4e1f-8f9e-ac661b9f328d/cvm-batch-3_objects,In copyright - educational use permitted; see http://rightsstatements.org/vocab/InC-EDU/1.0/ for more information,Texas A & M University. College of Veterinary Medicine & Biomedical Sciences|A&M College Studio,fedoraAdmin,1 black-and -white print (photograph); 7X11.5mm,2023-02-17T17:04:52.139000+00:00,https://api.library.tamu.edu/fcrepo/rest/4a/7d/ff/c4/4a7dffc4-04ec-4e1f-8f9e-ac661b9f328d/cvm-batch-3_objects/133/orderProxies|https://api.library.tamu.edu/fcrepo/rest/4a/7d/ff/c4/4a7dffc4-04ec-4e1f-8f9e-ac661b9f328d/cvm-batch-3_objects/133/pages,"From a book of personal photographs given to Jerome Jackson Waters Jr. from John N. Olson; both of the graduating class of 1913, on the event of their 1938 class reunion. During this same year, Waters became an Instructor at the Illinois National Guard.  In 1941,  he became Commanding Officer of the Sixth Training Regiment.  From 1942 to 1944 he was appointed Commanding Officer Artillery 76th Division.  From 1944 to 1945, he was Commanding Officer Artillery XXXII Corps. Brig. Gen. Jerome J. Waters passed away in 1972.",Halbouty Geosciences Building at the A&M College of Texas,1930s,"Waters, Jerome Jackson--Photograph collections|College buildings|Historic buildings|Halbouty Geosciences Building|Agricultural and Mechanical College of Texas--Buildings",College of Veterinary Medicine Image Collection,"The Halbouty Geosciences Building was designed by the campus's first architect, Frederick E. Giesecke, with the help of Samuel C. P. Vosper who would become the campus's second architect. It was a four story building with cast stone features and had multi-colored tile work. The center tower held a several thousand gallon capacity water tank that helped maintain pressure to the hot water used in the campus heating system.  This tower was removed in 1972.",1938-06-04,0131,StillImage,2023-02-17T17:04:52.139000+00:00,false,https://api.library.tamu.edu/fcrepo/rest/4a/7d/ff/c4/4a7dffc4-04ec-4e1f-8f9e-ac661b9f328d/cvm-batch-3_objects/133/pages/page_0/files/CVM_0131.jpg,College Station|Texas,,
Photographs,fedoraAdmin,,https://api.library.tamu.edu/fcrepo/rest/4a/7d/ff/c4/4a7dffc4-04ec-4e1f-8f9e-ac661b9f328d/cvm-batch-3_objects,In copyright - educational use permitted; see http://rightsstatements.org/vocab/InC-EDU/1.0/ for more information,Texas A & M University. College of Veterinary Medicine & Biomedical Sciences,fedoraAdmin,"1 black-and -white print (photograph); ) 16.5X24mm, reverse image 9X13.5mm",2023-02-17T16:35:43.528000+00:00,https://api.library.tamu.edu/fcrepo/rest/4a/7d/ff/c4/4a7dffc4-04ec-4e1f-8f9e-ac661b9f328d/cvm-batch-3_objects/44/pages|https://api.library.tamu.edu/fcrepo/rest/4a/7d/ff/c4/4a7dffc4-04ec-4e1f-8f9e-ac661b9f328d/cvm-batch-3_objects/44/orderProxies,,Bleeding a Pig,1900s,"Teaching Rounds|Blood|Classical Swine Fever|Practicums|Serum|Veterinary medicine--History|Education, Veterinary|Swine|Agricultural and Mechanical College of Texas. School of Veterinary Medicine--Students|Clinical Competence|Veterinary students",College of Veterinary Medicine Image Collection,Ten veterinary students in the first class of 1916 stand around a treatment table with a bleeding pig.  The man on far left holds white basin while man on the far right appears to be collecting the blood in a graduated cylinder.,1916,0043|0068,StillImage,2023-02-17T16:35:43.528000+00:00,false,https://api.library.tamu.edu/fcrepo/rest/4a/7d/ff/c4/4a7dffc4-04ec-4e1f-8f9e-ac661b9f328d/cvm-batch-3_objects/44/pages/page_0/files/CVM_0043.jpg,College Station|Texas,,
Photographs,fedoraAdmin,,https://api.library.tamu.edu/fcrepo/rest/4a/7d/ff/c4/4a7dffc4-04ec-4e1f-8f9e-ac661b9f328d/cvm-batch-3_objects,In copyright - educational use permitted; see http://rightsstatements.org/vocab/InC-EDU/1.0/ for more information,Texas A & M University Graphic Services|Texas A & M University. College of Veterinary Medicine & Biomedical Sciences,fedoraAdmin,1 color print (photograph); 10X15mm,2023-02-17T18:06:59.854000+00:00,https://api.library.tamu.edu/fcrepo/rest/4a/7d/ff/c4/4a7dffc4-04ec-4e1f-8f9e-ac661b9f328d/cvm-batch-3_objects/316/pages|https://api.library.tamu.edu/fcrepo/rest/4a/7d/ff/c4/4a7dffc4-04ec-4e1f-8f9e-ac661b9f328d/cvm-batch-3_objects/316/orderProxies,,"Laura Bush speaks to Texas Folic Acid Council, number 05",1990s,"Campus visits|Special Events|Speeches, addresses, etc.|Bush, Laura Welch, 1946-|Congenital Abnormalities|Texas Folic Acid Council|Prenatal care|Texas A & M University. Birth Defects Research Laboratory",College of Veterinary Medicine Image Collection,"A close-up view of Mrs. Laura Bush during her speech to the Texas Folic Acid Council to encourage prenatal care in the prevention of birth defects. Laura Bush,  the ""First Lady of Texas,"" visited the College of Veterinary Medicine's Birth Defects Research Lab, and toured the campus as part of her ""Take Time for Kids"" campaign.  The Birth Defects Research Lab, run by Dr. Richard Finnell, was a March of Dimes Grant recipient.",1999,0316,StillImage,2023-02-17T18:06:59.854000+00:00,false,https://api.library.tamu.edu/fcrepo/rest/4a/7d/ff/c4/4a7dffc4-04ec-4e1f-8f9e-ac661b9f328d/cvm-batch-3_objects/316/pages/page_0/files/CVM_0316.jpg,Texas|College Station,"Written on photograph: ""1999 Texas Folic Acid Council and Birth Defects research Laboratory visit.""",
