dc_type,fedora_createdBy,dc_creator,fedora_hasParent,dc_rights,dc_contributor,fedora_lastModifiedBy,dcterms_extent,fedora_created,ldp_contains,dcterms_provenance,dc_title,dcterms_temporal,dc_subject,dcterms_isPartOf,dcterms_abstract,dcterms_created,dc_identifier,dcterms_type,fedora_lastModified,fedora_writable,files,dcterms_spatial,tamudigital_local/details,dc_description
Photographs,fedoraAdmin,"Reagan, Ronda",https://api.library.tamu.edu/fcrepo/rest/4a/7d/ff/c4/4a7dffc4-04ec-4e1f-8f9e-ac661b9f328d/cvm-batch-3_objects,In copyright - educational use permitted; see http://rightsstatements.org/vocab/InC-EDU/1.0/ for more information,Texas A & M University. College of Veterinary Medicine & Biomedical Sciences,fedoraAdmin,1 black-and -white print (photograph); 12X17mm,2023-02-17T17:15:12.548000+00:00,https://api.library.tamu.edu/fcrepo/rest/4a/7d/ff/c4/4a7dffc4-04ec-4e1f-8f9e-ac661b9f328d/cvm-batch-3_objects/164/pages|https://api.library.tamu.edu/fcrepo/rest/4a/7d/ff/c4/4a7dffc4-04ec-4e1f-8f9e-ac661b9f328d/cvm-batch-3_objects/164/orderProxies,,"Collecting Aquatic Animal Samples in Galveston Bay, Texas",,"Wardel, Bill|Fish Diseases|Bullinton, Tom|Diseases|Galveston Bay (Tex.)|Aquatic animals|Sampling|Aquatic biology",College of Veterinary Medicine Image Collection,"Bill Wardel (on the right with a beard) and Tom Bullinton (on the left) are shown collecting samples on a beach in Galveston Bay for disease investigations in the aquatic animal medicine program at Texas A&M.   In 1969, the College of Veterinary Medicine at Texas A&M University began to acquire and develop the expertise necessary to encompass aquatic animal medicine. At the time, it was one of the few veterinary colleges in the United States to conduct research and offer instruction on infectious and non-infectious diseases of marine mammals and of fish and shellfish, with special emphasis on marine species.",Between 1969 and 1980,0163,StillImage,2023-02-17T17:15:12.548000+00:00,false,https://api.library.tamu.edu/fcrepo/rest/4a/7d/ff/c4/4a7dffc4-04ec-4e1f-8f9e-ac661b9f328d/cvm-batch-3_objects/164/pages/page_0/files/CVM_0163.jpg,Galveston Bay|Texas,,
Photographs,fedoraAdmin,,https://api.library.tamu.edu/fcrepo/rest/4a/7d/ff/c4/4a7dffc4-04ec-4e1f-8f9e-ac661b9f328d/cvm-batch-3_objects,In copyright - educational use permitted; see http://rightsstatements.org/vocab/InC-EDU/1.0/ for more information,Texas A & M University. College of Veterinary Medicine & Biomedical Sciences,fedoraAdmin,1 color print (photograph); 12.5X12.5 mm,2023-02-17T17:41:55.236000+00:00,https://api.library.tamu.edu/fcrepo/rest/4a/7d/ff/c4/4a7dffc4-04ec-4e1f-8f9e-ac661b9f328d/cvm-batch-3_objects/243/pages|https://api.library.tamu.edu/fcrepo/rest/4a/7d/ff/c4/4a7dffc4-04ec-4e1f-8f9e-ac661b9f328d/cvm-batch-3_objects/243/orderProxies,,"1974 Commencement Ceremony, number 7",1970s,College graduates|Commencement ceremonies|Special Events|Veterinary students|Texas A & M University. College of Veterinary Medicine--Students,College of Veterinary Medicine Image Collection,Four Veterinary Medicine graduates in caps and gowns are seated along a white wall waiting for the start of commencement exercises.,1974,0243,StillImage,2023-02-17T17:41:55.236000+00:00,false,https://api.library.tamu.edu/fcrepo/rest/4a/7d/ff/c4/4a7dffc4-04ec-4e1f-8f9e-ac661b9f328d/cvm-batch-3_objects/243/pages/page_0/files/CVM_0243.jpg,College Station|Texas,"Written on photograph: ""August 1974 Commencement.""",
Photographs,fedoraAdmin,,https://api.library.tamu.edu/fcrepo/rest/4a/7d/ff/c4/4a7dffc4-04ec-4e1f-8f9e-ac661b9f328d/cvm-batch-3_objects,In copyright - educational use permitted; see http://rightsstatements.org/vocab/InC-EDU/1.0/ for more information,Texas A & M University. College of Veterinary Medicine & Biomedical Sciences,fedoraAdmin,1 black-and -white print (photograph); 19X24mm,2023-02-17T17:34:51.811000+00:00,https://api.library.tamu.edu/fcrepo/rest/4a/7d/ff/c4/4a7dffc4-04ec-4e1f-8f9e-ac661b9f328d/cvm-batch-3_objects/222/orderProxies|https://api.library.tamu.edu/fcrepo/rest/4a/7d/ff/c4/4a7dffc4-04ec-4e1f-8f9e-ac661b9f328d/cvm-batch-3_objects/222/pages,,Southwestern Veterinarian Award Recipient: B.C. Robison,1970s,"Veterinary teachers|Rundell, Jim|Award presentations|Robison, B. C.|American Veterinary Medical Association--Awards|Texas A & M University. College of Veterinary Medicine--Faculty|Student publications--Awards|Veterinary medicine--Awards|Veterinary students|Veterinary medicine--Periodicals--Awards|Southwestern Veterinarian|Texas A & M University. College of Veterinary Medicine--Students",College of Veterinary Medicine Image Collection,"B. C. Robison, on the right (Editor  of ""Southwestern Veterinarian"") receives the 1971-72 Southwestern Veterinarian Award from Jim Rundell, (Production Editor, ""Southwestern Veterinarian"") on left.  The  ""Southwestern Veterinarian"" was a journal published by the Texas A&M student chapter of the AVMA This photograph was taken on July 7, 1972 during the annual award ceremony honoring the academic achievements of undergraduate students at the College of Veterinary Medicine.",1972-07-07,0222,StillImage,2023-02-17T17:34:51.811000+00:00,false,https://api.library.tamu.edu/fcrepo/rest/4a/7d/ff/c4/4a7dffc4-04ec-4e1f-8f9e-ac661b9f328d/cvm-batch-3_objects/222/pages/page_0/files/CVM_0222.jpg,College Station|Texas,"Written on photograph: ""B. C. Robison accepts the Southwestern Veterinarian Award from Jim Rundell.""",
Photographs,fedoraAdmin,,https://api.library.tamu.edu/fcrepo/rest/4a/7d/ff/c4/4a7dffc4-04ec-4e1f-8f9e-ac661b9f328d/cvm-batch-3_objects,In copyright - educational use permitted; see http://rightsstatements.org/vocab/InC-EDU/1.0/ for more information,Texas A & M University. College of Veterinary Medicine & Biomedical Sciences,fedoraAdmin,"1 color print (photograph); 19.5X24.5mm, mounted",2023-02-17T17:45:54.010000+00:00,https://api.library.tamu.edu/fcrepo/rest/4a/7d/ff/c4/4a7dffc4-04ec-4e1f-8f9e-ac661b9f328d/cvm-batch-3_objects/255/orderProxies|https://api.library.tamu.edu/fcrepo/rest/4a/7d/ff/c4/4a7dffc4-04ec-4e1f-8f9e-ac661b9f328d/cvm-batch-3_objects/255/pages,,"Veterinary Students in a Lab, number 1",,"Classes|Teaching|Veterinary students|Texas A & M University. College of Veterinary Medicine--Students|Veterinary laboratories|Education, Veterinary|Women veterinary students",College of Veterinary Medicine Image Collection,"A female student, along with other veterinary students are working in a lab.",,0255,StillImage,2023-02-17T17:45:54.010000+00:00,false,https://api.library.tamu.edu/fcrepo/rest/4a/7d/ff/c4/4a7dffc4-04ec-4e1f-8f9e-ac661b9f328d/cvm-batch-3_objects/255/pages/page_0/files/CVM_0255.jpg,College Station|Texas,,
Photographs,fedoraAdmin,,https://api.library.tamu.edu/fcrepo/rest/4a/7d/ff/c4/4a7dffc4-04ec-4e1f-8f9e-ac661b9f328d/cvm-batch-3_objects,In copyright - educational use permitted; see http://rightsstatements.org/vocab/InC-EDU/1.0/ for more information,Texas A & M University. College of Veterinary Medicine & Biomedical Sciences,fedoraAdmin,"1 color print (photograph); 20x24.5mm, mounted",2023-02-17T17:53:28.426000+00:00,https://api.library.tamu.edu/fcrepo/rest/4a/7d/ff/c4/4a7dffc4-04ec-4e1f-8f9e-ac661b9f328d/cvm-batch-3_objects/277/pages|https://api.library.tamu.edu/fcrepo/rest/4a/7d/ff/c4/4a7dffc4-04ec-4e1f-8f9e-ac661b9f328d/cvm-batch-3_objects/277/orderProxies,,"Stevenson Companion Animal Life-Care Center, number 2: Construction Site",1990s,College buildings--Planning|Campus planning|Building sites|School lands|Animal housing--Planning|Stevenson Companion Animal Life-Care Center|Texas A & M University. College of Veterinary Medicine--Buildings--Planning,College of Veterinary Medicine Image Collection,"A view of the building that would later become the Stevenson Companion Animal Life-Care Center, while it was still under construction.  Funds for the construction of the original center facility were gifts from Ms. Stevenson of La Porte, Texas and the W.P. and Bulah Luse Foundation in Dallas, Texas. The Board of Regents approved the naming of the center's first building the ""W.P. Luse Foundation Building"" in recognition of the foundation's support of the center. The W.P. Luse Foundation Building and the Stevenson Companion Animal Life-Care Center were dedicated on March 26, 1993. The first pets to live at the center arrived in November  1993.",Between 1990 and 1993,0277,StillImage,2023-02-17T17:53:28.426000+00:00,false,https://api.library.tamu.edu/fcrepo/rest/4a/7d/ff/c4/4a7dffc4-04ec-4e1f-8f9e-ac661b9f328d/cvm-batch-3_objects/277/pages/page_0/files/CVM_0277.jpg,College Station|Texas,"Written on photograph: ""TVMC Buildings.""",
Photographs,fedoraAdmin,,https://api.library.tamu.edu/fcrepo/rest/4a/7d/ff/c4/4a7dffc4-04ec-4e1f-8f9e-ac661b9f328d/cvm-batch-3_objects,In copyright - educational use permitted; see http://rightsstatements.org/vocab/InC-EDU/1.0/ for more information,Texas A & M University. College of Veterinary Medicine & Biomedical Sciences,fedoraAdmin,1 black-and -white print (photograph); 12.5X17.5mm,2023-02-17T17:27:51.737000+00:00,https://api.library.tamu.edu/fcrepo/rest/4a/7d/ff/c4/4a7dffc4-04ec-4e1f-8f9e-ac661b9f328d/cvm-batch-3_objects/202/orderProxies|https://api.library.tamu.edu/fcrepo/rest/4a/7d/ff/c4/4a7dffc4-04ec-4e1f-8f9e-ac661b9f328d/cvm-batch-3_objects/202/pages,,"College of Veterinary Medicine Marker, number 1",,Historic buildings|College buildings|Texas A & M University. College of Veterinary Medicine--Buildings,College of Veterinary Medicine Image Collection,A brick sign Identifying the College of Veterinary Medicine.  The Small Animal Clinic and the Administration building for the College is seen in frame upper right. This was removed by 2014.,Between 1965 and 1975,0202,StillImage,2023-02-17T17:27:51.737000+00:00,false,https://api.library.tamu.edu/fcrepo/rest/4a/7d/ff/c4/4a7dffc4-04ec-4e1f-8f9e-ac661b9f328d/cvm-batch-3_objects/202/pages/page_0/files/CVM_0202.jpg,Texas|College Station,,
Photographs,fedoraAdmin,,https://api.library.tamu.edu/fcrepo/rest/4a/7d/ff/c4/4a7dffc4-04ec-4e1f-8f9e-ac661b9f328d/cvm-batch-3_objects,In copyright - educational use permitted; see http://rightsstatements.org/vocab/InC-EDU/1.0/ for more information,Texas A & M University. College of Veterinary Medicine & Biomedical Sciences,fedoraAdmin,1 color print (photograph); 12.5X12.5 mm,2023-02-17T17:41:15.580000+00:00,https://api.library.tamu.edu/fcrepo/rest/4a/7d/ff/c4/4a7dffc4-04ec-4e1f-8f9e-ac661b9f328d/cvm-batch-3_objects/241/pages|https://api.library.tamu.edu/fcrepo/rest/4a/7d/ff/c4/4a7dffc4-04ec-4e1f-8f9e-ac661b9f328d/cvm-batch-3_objects/241/orderProxies,,"1974 Commencement Ceremony, number 5",1970s,College graduates|Commencement ceremonies|Special Events|Veterinary students|Texas A & M University. College of Veterinary Medicine--Students,College of Veterinary Medicine Image Collection,Three Veterinary Medicine graduates are shown in commencement regalia without caps either prior or after the ceremony. The man on the left adjusts his tie while the man in center looks on. The man on right is zipping up his gown.,1974,0241,StillImage,2023-02-17T17:41:15.580000+00:00,false,https://api.library.tamu.edu/fcrepo/rest/4a/7d/ff/c4/4a7dffc4-04ec-4e1f-8f9e-ac661b9f328d/cvm-batch-3_objects/241/pages/page_0/files/CVM_0241.jpg,College Station|Texas,"Written on photograph: ""August 1974 Commencement.""",
Photographs,fedoraAdmin,,https://api.library.tamu.edu/fcrepo/rest/4a/7d/ff/c4/4a7dffc4-04ec-4e1f-8f9e-ac661b9f328d/cvm-batch-3_objects,In copyright - educational use permitted; see http://rightsstatements.org/vocab/InC-EDU/1.0/ for more information,Texas A & M University. College of Veterinary Medicine & Biomedical Sciences,fedoraAdmin,1 black-and-white proof size print with negative (photograph); 4X5.5mm,2023-02-17T17:39:16.233000+00:00,https://api.library.tamu.edu/fcrepo/rest/4a/7d/ff/c4/4a7dffc4-04ec-4e1f-8f9e-ac661b9f328d/cvm-batch-3_objects/235/orderProxies|https://api.library.tamu.edu/fcrepo/rest/4a/7d/ff/c4/4a7dffc4-04ec-4e1f-8f9e-ac661b9f328d/cvm-batch-3_objects/235/pages,,Bovine Turn-Around,1980s,College buildings|Texas A & M University. College of Veterinary Medicine--Buildings|Corrals|College facilities|Cattle pens,College of Veterinary Medicine Image Collection,A roofed structure without walls contains rails that were used to guide in cattle.,1981,0235,StillImage,2023-02-17T17:39:16.233000+00:00,false,https://api.library.tamu.edu/fcrepo/rest/4a/7d/ff/c4/4a7dffc4-04ec-4e1f-8f9e-ac661b9f328d/cvm-batch-3_objects/235/pages/page_0/files/CVM_235.jpg,College Station|Texas,"Written on photograph: ""Bovine Turn-Around Constructed November 1981.""",
Photographs,fedoraAdmin,,https://api.library.tamu.edu/fcrepo/rest/4a/7d/ff/c4/4a7dffc4-04ec-4e1f-8f9e-ac661b9f328d/cvm-batch-3_objects,In copyright - educational use permitted; see http://rightsstatements.org/vocab/InC-EDU/1.0/ for more information,Texas A & M University. College of Veterinary Medicine & Biomedical Sciences,fedoraAdmin,1 color slide; 5X5mm slide,2023-02-17T18:29:02.825000+00:00,https://api.library.tamu.edu/fcrepo/rest/4a/7d/ff/c4/4a7dffc4-04ec-4e1f-8f9e-ac661b9f328d/cvm-batch-3_objects/382/orderProxies|https://api.library.tamu.edu/fcrepo/rest/4a/7d/ff/c4/4a7dffc4-04ec-4e1f-8f9e-ac661b9f328d/cvm-batch-3_objects/382/pages,,"Stevenson Companion Animal Life-Care Center Animals and Caregivers, number 24",1990s,Cats|Animal housing|Small Animal Medicine and Surgery|Stevenson Companion Animal Life-Care Center|Pets,College of Veterinary Medicine Image Collection,One of the feline residents of the Stevenson Companion Animal Life-Care Center gets comfortable on top of paperwork on a staff person's desk.,1999-05,0354,StillImage,2023-02-17T18:29:02.825000+00:00,false,https://api.library.tamu.edu/fcrepo/rest/4a/7d/ff/c4/4a7dffc4-04ec-4e1f-8f9e-ac661b9f328d/cvm-batch-3_objects/382/pages/page_0/files/CVM_0354.jpg,College Station|Texas,,
Photographs,fedoraAdmin,,https://api.library.tamu.edu/fcrepo/rest/4a/7d/ff/c4/4a7dffc4-04ec-4e1f-8f9e-ac661b9f328d/cvm-batch-3_objects,In copyright - educational use permitted; see http://rightsstatements.org/vocab/InC-EDU/1.0/ for more information,Texas A & M University. College of Veterinary Medicine & Biomedical Sciences,fedoraAdmin,"1 color print (photograph); 15.5X23mm, mounted",2023-02-17T17:45:13.948000+00:00,https://api.library.tamu.edu/fcrepo/rest/4a/7d/ff/c4/4a7dffc4-04ec-4e1f-8f9e-ac661b9f328d/cvm-batch-3_objects/253/orderProxies|https://api.library.tamu.edu/fcrepo/rest/4a/7d/ff/c4/4a7dffc4-04ec-4e1f-8f9e-ac661b9f328d/cvm-batch-3_objects/253/pages,,Clinical Sciences Building at the College of Veterinary Medicine,,Historic buildings|Clinical Sciences Building|College buildings|Texas A & M University. College of Veterinary Medicine--Buildings,College of Veterinary Medicine Image Collection,A view of the Clinical Sciences Building taken from across HWY 60 or Raymond Stotzer Blvd.,1983-12,0126|0253,StillImage,2023-02-17T17:45:13.948000+00:00,false,https://api.library.tamu.edu/fcrepo/rest/4a/7d/ff/c4/4a7dffc4-04ec-4e1f-8f9e-ac661b9f328d/cvm-batch-3_objects/253/pages/page_0/files/CVM_0253.jpg,College Station|Texas,"Written on photograph: ""Clinical Sciences BLDG. """,
Photographs,fedoraAdmin,,https://api.library.tamu.edu/fcrepo/rest/4a/7d/ff/c4/4a7dffc4-04ec-4e1f-8f9e-ac661b9f328d/cvm-batch-3_objects,In copyright - educational use permitted; see http://rightsstatements.org/vocab/InC-EDU/1.0/ for more information,Texas A & M University. College of Veterinary Medicine & Biomedical Sciences,fedoraAdmin,1 black-and -white print (photograph); 20.5X25mm,2023-02-17T17:10:50.710000+00:00,https://api.library.tamu.edu/fcrepo/rest/4a/7d/ff/c4/4a7dffc4-04ec-4e1f-8f9e-ac661b9f328d/cvm-batch-3_objects/151/pages|https://api.library.tamu.edu/fcrepo/rest/4a/7d/ff/c4/4a7dffc4-04ec-4e1f-8f9e-ac661b9f328d/cvm-batch-3_objects/151/orderProxies,,"Equine Surgery, number 1",,"Horses|Clinical Competence|Large Animal Medicine and Surgery|Veterinary students|Trephining|Agricultural and Mechanical College of Texas. School of Veterinary Medicine--Students|Veterinary teachers|Veterinarians|Teaching Rounds|Agricultural and Mechanical College of Texas. School of Veterinary Medicine--Faculty|Teeth|Education, Veterinary|Veterinary dentistry|Hospitals, Teaching|Hospitals, Animal|Equine dentistry",College of Veterinary Medicine Image Collection,"A horse patient is secured to a surgical table.  While a group of men in the background observe, a young veterinarian leans on the horse's neck in order to perform a trephination of the equine tooth.  Extra lighting is provided to assist in the procedure.",,0150,StillImage,2023-02-17T17:10:50.710000+00:00,false,https://api.library.tamu.edu/fcrepo/rest/4a/7d/ff/c4/4a7dffc4-04ec-4e1f-8f9e-ac661b9f328d/cvm-batch-3_objects/151/pages/page_0/files/CVM_0150.jpg,Texas|College Station,,
Photographs,fedoraAdmin,,https://api.library.tamu.edu/fcrepo/rest/4a/7d/ff/c4/4a7dffc4-04ec-4e1f-8f9e-ac661b9f328d/cvm-batch-3_objects,In copyright - educational use permitted; see http://rightsstatements.org/vocab/InC-EDU/1.0/ for more information,Texas A & M University. College of Veterinary Medicine & Biomedical Sciences,fedoraAdmin,1 black-and -white print (photograph),2023-02-17T16:23:39.679000+00:00,https://api.library.tamu.edu/fcrepo/rest/4a/7d/ff/c4/4a7dffc4-04ec-4e1f-8f9e-ac661b9f328d/cvm-batch-3_objects/15/orderProxies|https://api.library.tamu.edu/fcrepo/rest/4a/7d/ff/c4/4a7dffc4-04ec-4e1f-8f9e-ac661b9f328d/cvm-batch-3_objects/15/pages,,Surgery on a Horse at an Early Large Animal Clinic,,"Johnson, W.T.|Education, Veterinary|Surgery Department, Hospital|Veterinary medicine--History|Surgery, Veterinary|Hospitals, Animal|Surgical instruments and apparatus|Horses|Childers, R.R.|Clinical Competence|Large Animal Medicine and Surgery|Veterinary students|Reid, J. P.|Dunn, S.R.|Teaching Rounds|Hospital buildings|Surgical Attire|Practicums",College of Veterinary Medicine Image Collection,This image depicts seven veterinary students in equine surgery in a large animal clinic; left to right: 1/unknown;   2/ J.P. Reid; 3/Unknown; 4/ R.R. Childers; 5/ S.R. Dunn; 6/ W.T. Johnson; 7/unknown. This image depicts an example of the first known equine surgical table.,Between 1915 and 1925,0014,StillImage,2023-02-17T16:23:39.679000+00:00,false,https://api.library.tamu.edu/fcrepo/rest/4a/7d/ff/c4/4a7dffc4-04ec-4e1f-8f9e-ac661b9f328d/cvm-batch-3_objects/15/pages/page_0/files/CVM_0014.jpg,College Station|Texas,,
Photographs,fedoraAdmin,,https://api.library.tamu.edu/fcrepo/rest/4a/7d/ff/c4/4a7dffc4-04ec-4e1f-8f9e-ac661b9f328d/cvm-batch-3_objects,In copyright - educational use permitted; see http://rightsstatements.org/vocab/InC-EDU/1.0/ for more information,Texas A & M University. College of Veterinary Medicine & Biomedical Sciences|A&M College Studio,fedoraAdmin,1 black-and -white print (photograph); 7X11.5mm,2023-02-17T17:03:14.289000+00:00,https://api.library.tamu.edu/fcrepo/rest/4a/7d/ff/c4/4a7dffc4-04ec-4e1f-8f9e-ac661b9f328d/cvm-batch-3_objects/128/pages|https://api.library.tamu.edu/fcrepo/rest/4a/7d/ff/c4/4a7dffc4-04ec-4e1f-8f9e-ac661b9f328d/cvm-batch-3_objects/128/orderProxies,"From a book of personal photographs given to Jerome Jackson Waters Jr. from John N. Olson; both of the graduating class of 1913, on the event of their 1938 class reunion. During this same year, Waters became an Instructor at the Illinois National Guard.  In 1941,  he became Commanding Officer of the Sixth Training Regiment.  From 1942 to 1944 he was appointed Commanding Officer Artillery 76th Division.  From 1944 to 1945, he was Commanding Officer Artillery XXXII Corps. Brig. Gen. Jerome J. Waters passed away in 1972.",Sbisa Hall at the A&M College of Texas,1930s,"Waters, Jerome Jackson--Photograph collections|Dining rooms|College buildings|Agricultural and Mechanical College of Texas--Buildings|Historic buildings|Sbisa Dining Hall",College of Veterinary Medicine Image Collection,"In this image the Sbisa Dining Hall is shown at a time before the fountain referred to by students as the fish pond was built. Construction on this dining hall was begun in 1912 after an early morning kitchen fire occurred on Nov. 11, 1911 and destroyed the original campus Mess Hall. The new hall was completed in 1926.  Sbisa is named in honor of Bernard Sbisa, an Austrian-born New Orleans chef and college steward who prepared hearty and timely meals for Aggies for more than 50 years.",1938-06-04,0126,StillImage,2023-02-17T17:03:14.289000+00:00,false,https://api.library.tamu.edu/fcrepo/rest/4a/7d/ff/c4/4a7dffc4-04ec-4e1f-8f9e-ac661b9f328d/cvm-batch-3_objects/128/pages/page_0/files/CVM_0126.jpg,College Station|Texas,,
Photographs,fedoraAdmin,,https://api.library.tamu.edu/fcrepo/rest/4a/7d/ff/c4/4a7dffc4-04ec-4e1f-8f9e-ac661b9f328d/cvm-batch-3_objects,In copyright - educational use permitted; see http://rightsstatements.org/vocab/InC-EDU/1.0/ for more information,Texas A & M University. College of Veterinary Medicine & Biomedical Sciences,fedoraAdmin,1 black-and -white print (photograph); 12X16.5mm,2023-02-17T17:14:52.943000+00:00,https://api.library.tamu.edu/fcrepo/rest/4a/7d/ff/c4/4a7dffc4-04ec-4e1f-8f9e-ac661b9f328d/cvm-batch-3_objects/163/pages|https://api.library.tamu.edu/fcrepo/rest/4a/7d/ff/c4/4a7dffc4-04ec-4e1f-8f9e-ac661b9f328d/cvm-batch-3_objects/163/orderProxies,,Communicable Diseases Study with Monkey at the Institute of Comparative Medicine,1970s,"Primates|Physical Examination|Education, Veterinary|Institute of Comparative Medicine--Research|Zoonoses|Veterinary students|Texas A & M University. College of Veterinary Medicine--Students|Monkeys|Communicable diseases",College of Veterinary Medicine Image Collection,Two unidentified men from the Institute of Comparative Medicine examine a tiny monkey for a study on communicable diseases.,Between 1972 and 1980,0162,StillImage,2023-02-17T17:14:52.943000+00:00,false,https://api.library.tamu.edu/fcrepo/rest/4a/7d/ff/c4/4a7dffc4-04ec-4e1f-8f9e-ac661b9f328d/cvm-batch-3_objects/163/pages/page_0/files/CVM_0162.jpg,College Station|Texas,,
Photographs,fedoraAdmin,,https://api.library.tamu.edu/fcrepo/rest/4a/7d/ff/c4/4a7dffc4-04ec-4e1f-8f9e-ac661b9f328d/cvm-batch-3_objects,In copyright - educational use permitted; see http://rightsstatements.org/vocab/InC-EDU/1.0/ for more information,Texas A & M University. College of Veterinary Medicine & Biomedical Sciences,fedoraAdmin,"1 color print (photograph); 12X17mm, mounted",2023-02-17T18:21:00.306000+00:00,https://api.library.tamu.edu/fcrepo/rest/4a/7d/ff/c4/4a7dffc4-04ec-4e1f-8f9e-ac661b9f328d/cvm-batch-3_objects/358/pages|https://api.library.tamu.edu/fcrepo/rest/4a/7d/ff/c4/4a7dffc4-04ec-4e1f-8f9e-ac661b9f328d/cvm-batch-3_objects/358/orderProxies,,"Stevenson Companion Animal Life-Care Center Groundbreaking, number 03",,"Texas A & M University. College of Veterinary Medicine--Benefactors|Texas A & M University. College of Veterinary Medicine--Awards|Animal housing|Award presentations|Texas A & M University. College of Veterinary Medicine--Faculty|Ellet, E. W. (Ned)|Stevenson Companion Animal Life-Care Center|Stevenson, Madlin",College of Veterinary Medicine Image Collection,"Dr. E.W. ""Ned"" Ellet presents an award plaque to Madlin Stevenson who was a benefactor of the Stevenson Center.",,0330,StillImage,2023-02-17T18:21:00.306000+00:00,false,https://api.library.tamu.edu/fcrepo/rest/4a/7d/ff/c4/4a7dffc4-04ec-4e1f-8f9e-ac661b9f328d/cvm-batch-3_objects/358/pages/page_0/files/CVM_0330.jpg,College Station|Texas,"Written on photograph: ""Madelin [sic] Stevenson, Dr. Ellet, Groundbreaking-Companion Animal Center.""",
Photographs,fedoraAdmin,"Golden, George E.",https://api.library.tamu.edu/fcrepo/rest/4a/7d/ff/c4/4a7dffc4-04ec-4e1f-8f9e-ac661b9f328d/cvm-batch-3_objects,In copyright - educational use permitted; see http://rightsstatements.org/vocab/InC-EDU/1.0/ for more information,United States. Department of Agriculture|Texas A & M University. College of Veterinary Medicine & Biomedical Sciences,fedoraAdmin,1 black-and -white print (photograph); 9X14.5mm,2023-02-17T16:52:27.121000+00:00,https://api.library.tamu.edu/fcrepo/rest/4a/7d/ff/c4/4a7dffc4-04ec-4e1f-8f9e-ac661b9f328d/cvm-batch-3_objects/95/pages|https://api.library.tamu.edu/fcrepo/rest/4a/7d/ff/c4/4a7dffc4-04ec-4e1f-8f9e-ac661b9f328d/cvm-batch-3_objects/95/orderProxies,"Written on photograph: ""This collection of kodak pictures, made by the late, Dr. Frank D. Porter in the course of his life work and interest with diseased animals is bequeathed to the library of Texas A&M College at his request, in the hope it will be of service and help to students in the pursuit of their career.  The pictures were made by Dr. F. D. Porter while on the Foot & Mouth disease in California in year of 1930 and in Houston in 1924.  And some were acquired from G. E. Golden. Dr. Frank D. Porter, Born-Indiana-1879, Died-Ft. Worth, TX-May 22, 1950.""","Frank D. Porter-Golden Foot & Mouth Collection, number 43",1920s,"Animal Diseases|Livestock--Inspection|Porter, Frank D.--Photograph collections|Foot-and-Mouth Disease|Hoofs",College of Veterinary Medicine Image Collection,"A close-up view of a slough of skin on a cow's coronary band, the result of ruptured vesicles of foot-and-mouth disease during the Texas outbreak in 1925.",1925,0093,StillImage,2023-02-17T16:52:27.121000+00:00,false,https://api.library.tamu.edu/fcrepo/rest/4a/7d/ff/c4/4a7dffc4-04ec-4e1f-8f9e-ac661b9f328d/cvm-batch-3_objects/95/pages/page_0/files/CVM_0093.jpg,Texas,,
